	Unnamed: 0	id	paper_id	headers	local_pos	global_pos	local_pct	global_pct	sentences	labels
0	123	123	S01-dutch	title	1	1	4.0	1.0	Dutch Word Sense Disambiguation: Data and Preliminary Results	1
1	124	124	S01-dutch	abstract	1	2	4.0	1.0	We describe the Dutch word sense disambiguation data submitted to SENSEVAL-2, and give preliminary results on the data using a WSD system based on memory-based learning and statistical keyword selection.	0
2	218	218	S01-english-allwords	title	1	1	4.0	1.0	English Tasks: All-Words and Verb Lexical Sample	1
3	219	219	S01-english-allwords	abstract	1	2	4.0	1.0	We describe our experience in preparing the lexicon and sense-tagged corpora used in the English all-words and lexical sample tasks of SENSEVAL-2.	0
4	544	544	S01-japanese-dictionary	Introduction	1	8	1.0	1.0	In SENSEVAL-2, there are two Japanese tasks, a translation task and a dictionary task.	0
5	545	545	S01-japanese-dictionary	Introduction	2	9	1.0	1.0	This paper describes the details of the dictionary task.	0
6	546	546	S01-japanese-dictionary	Introduction	3	10	1.0	1.0	First of all, let me introduce an overview of the Japanese dictionary task.	0
7	547	547	S01-japanese-dictionary	Introduction	4	11	2.0	1.0	This task is a lexical sample task.	0
8	548	548	S01-japanese-dictionary	Introduction	5	12	2.0	1.0	Word senses were defined according to the Iwanami Kokugo Jiten (Nishio et aL, 1994), a Japanese dictionary published by Iwanami Shoten.	0
9	549	549	S01-japanese-dictionary	Introduction	6	13	2.0	1.0	It was distributed to all participants as a sense inventory.	0
10	550	550	S01-japanese-dictionary	Introduction	7	14	2.0	1.0	Training data, a corpus consisting of 3,000 newspaper articles and manually annotated with sense IDs, was also distributed to participants.	0
11	551	551	S01-japanese-dictionary	Introduction	8	15	3.0	1.0	For evaluation, we distributed newspaper articles with marked target words as test documents.	0
12	552	552	S01-japanese-dictionary	Introduction	9	16	3.0	1.0	Participants were required to assign one or more sense IDs to each target word, optionally with associated probabilities.	1
13	553	553	S01-japanese-dictionary	Introduction	10	17	3.0	1.0	The number of target words was 100, 50 nouns and 50 verbs.	0
14	554	554	S01-japanese-dictionary	Introduction	11	18	3.0	1.0	One hundred instances of each target word were provided, making for a total of 10,000 instances.	0
15	555	555	S01-japanese-dictionary	Introduction	12	19	4.0	1.0	In what follows, Section 2 describes details of data used in the Japanese dictionary task.	0
16	556	556	S01-japanese-dictionary	Introduction	13	20	4.0	1.0	Section 3 describes the process to construct the 33 gold standard data, including the analysis of inter-tagger agreement.	0
17	557	557	S01-japanese-dictionary	Introduction	14	21	4.0	1.0	Section 4 briefly introduces participating systems and their results.	0
18	558	558	S01-japanese-dictionary	Introduction	15	22	4.0	1.0	Finally, Section 5 concludes this paper.	0
19	664	664	S01-japanese-translation	Introduction	1	8	1.0	1.0	In written texts, words which have multiple senses can be classified into two categories; homonyms and polysemous words.	0
20	665	665	S01-japanese-translation	Introduction	2	9	1.0	1.0	Generally speaking, while homonymy sense distinction is quite clear, polysemy sense distinction is very subtle and hard.	0
21	666	666	S01-japanese-translation	Introduction	3	10	1.0	1.0	English texts contain many homonyms.	0
22	667	667	S01-japanese-translation	Introduction	4	11	2.0	1.0	On the other hand, Japanese texts in which most content words are written by ideograms rarely contain homonyms.	0
23	668	668	S01-japanese-translation	Introduction	5	12	2.0	1.0	That is, the main target in Japanese WSD is polysemy, which makes Japanese WSD task setup very hard.	0
24	669	669	S01-japanese-translation	Introduction	6	13	2.0	1.0	What sense distinction of polysemous words is reasonable and effective heavily depends on how to use it, that is, an application ofWSD.	0
25	670	670	S01-japanese-translation	Introduction	7	14	2.0	1.0	Considering such a situation, in addition to the ordinary dictionary task we organized another task for Japanese, a translation task, in which word sense is defined according to translation distinction.	0
26	671	671	S01-japanese-translation	Introduction	8	15	3.0	1.0	Here, we set up the task assuming the example-based machine translation paradigm (Nagao, 1981).	0
27	672	672	S01-japanese-translation	Introduction	9	16	3.0	1.0	That is, first, a translation memory (TM) is constructed which contains, for each Japanese head word, a list of typical Japanese expressions (phrases/sentences) involving the head word and an English translation for each (Figure 1).	0
28	673	673	S01-japanese-translation	Introduction	10	17	3.0	1.0	We call a pair of Japanese and English expressions in the TM as a TM record.	0
29	674	674	S01-japanese-translation	Introduction	11	18	3.0	1.0	Given an evaluation document containing a target word, participants have to submit the TM record best approximating that usage.	1
30	675	675	S01-japanese-translation	Introduction	12	19	4.0	1.0	Alternatively, submissions can take the form of actual target word translations, or translations of phrases or sentences including each target word.	0
31	676	676	S01-japanese-translation	Introduction	13	20	4.0	1.0	This allows existing rule-based machine translation (MT) systems to participate in the task, and we can compare TM based systems with existing MT systems.	0
32	677	677	S01-japanese-translation	Introduction	14	21	4.0	1.0	For evaluation, we distributed newspaper articles.	0
33	678	678	S01-japanese-translation	Introduction	15	22	4.0	2.0	The number of target words was 40, and 30 instances of each target word were provided, making for a total of 1,200 instances.	0
34	1014	1014	S04-catalan	title	1	1	4.0	1.0	Senseval-3: The Catalan Lexical Sample Task	1
35	1015	1015	S04-catalan	abstract	1	2	1.0	1.0	Introduction	0
36	1016	1016	S04-catalan	abstract	2	3	2.0	1.0	In this paper we describe the Catalan Lexical Sample task.	0
37	1017	1017	S04-catalan	abstract	3	4	2.0	1.0	This task was initially devised for evaluating the role of unlabeled examples in supervised and semi-supervised learning systems for WSD and it is the counterpart of the Spanish Lexical Sample task.	0
38	1018	1018	S04-catalan	abstract	4	5	3.0	1.0	It was coordinated also with other lexical sample tasks (Basque, English, Italian, Rumanian, and Spanish) in order to share part of the target words.	0
39	1019	1019	S04-catalan	abstract	5	6	3.0	1.0	Firstly, we describe the methodology followed for developing the specific linguistic resources necessary for the task: the MiniDir-Cat lexicon and the MiniCors-Cat corpus.	0
40	1020	1020	S04-catalan	abstract	6	7	4.0	1.0	Secondly, we briefly describe the seven participant systems, the results obtained, and a comparative evaluation between them.	0
41	1021	1021	S04-catalan	abstract	7	8	4.0	1.0	All participant teams applied only pure supervised learning algorithms.	0
42	1138	1138	S04-english	Conclusion	1	44	2.0	4.0	The English lexical sample task in SENSEVAL-3 featured English ambiguous words that were to be tagged with their most appropriate WordNet or Wordsmyth sense.	1
43	1139	1139	S04-english	Conclusion	2	45	3.0	4.0	The objective of this task was to: (1)	0
44	1140	1140	S04-english	Conclusion	3	46	4.0	4.0	Determine feasibility of reliably finding the	0
45	1196	1196	S04-english-hindi	abstract	1	2	2.0	1.0	This paper describes the English-Hindi Multilingual lexical sample task in SENSEVAL-3.	0
46	1197	1197	S04-english-hindi	abstract	2	3	3.0	1.0	Rather than tagging an English word with a sense from an English dictionary, this task seeks to assign the most appropriate Hindi translation to an ambiguous target word.	1
47	1198	1198	S04-english-hindi	abstract	3	4	4.0	1.0	Training data was solicited via the Open Mind Word Expert (OMWE) from Web users who are fluent in English and Hindi.	0
48	1289	1289	S04-italian	Introduction	1	6	1.0	1.0	The task consisted in automatically determining the correct meaning of a word within a given context (i.e. a short text snippet).	1
49	1290	1290	S04-italian	Introduction	2	7	2.0	1.0	Systems' results were compared on the one hand to those achieved by human annotators (upper bound), and on the other hand to those returned by a basic algorithm (baseline).	0
50	1291	1291	S04-italian	Introduction	3	8	3.0	1.0	In the second section of this paper an overview of the task preparation is given and in the following one the main features of the participating systems are briefly outlined and the results of the evaluation exercise are presented.	0
51	1292	1292	S04-italian	Introduction	4	9	4.0	1.0	In the conclusions we give an overall judgement of the outcome of the task, suggesting possible improvements for the next campaign.	0
52	1363	1363	S04-italian-allwords	abstract	1	2	2.0	1.0	This paper describes the Italian all-words sense disambiguation task for Senseval-3.	1
53	1364	1364	S04-italian-allwords	abstract	2	3	4.0	1.0	The annotation procedure and criteria together with the encoding of multiwords are presented.	0
54	1365	1365	S04-italian-allwords	Introduction	1	4	1.0	1.0	This paper describes the Italian all-words sense disambiguation task for Senseval-3: about 5000 words were manually disambiguated according to the ItalWordNet (IWN) word senses.	1
55	1366	1366	S04-italian-allwords	Introduction	2	5	2.0	1.0	The first section briefly describes of the corpus and the lexical reference resource.	0
56	1367	1367	S04-italian-allwords	Introduction	3	6	2.0	1.0	The second section contains some general criteria adopted for the annotation of the corpus and illustrated by a series of examples.	0
57	1368	1368	S04-italian-allwords	Introduction	4	7	3.0	1.0	Issues connected to the treatment of phenomena typically found in corpora, e.g. abbreviations, foreign words, jargon, locutions are discussed.	0
58	1369	1369	S04-italian-allwords	Introduction	5	8	3.0	1.0	Furthermore, the encoding of compounds, metaphorical usages, and multiword units is described.	0
59	1370	1370	S04-italian-allwords	Introduction	6	9	4.0	1.0	Problems connected with i) the high granularity of sense distinctions in the lexical resource and ii) unsolvable ambiguities of the contexts are dealt with.	0
60	1371	1371	S04-italian-allwords	Introduction	7	10	4.0	1.0	Finally, it is evidenced how the annotation exercise can be of help in updating or tuning IWN, by adding missing senses and/or entries.	0
61	1455	1455	S04-logic-form-id	Introduction	1	7	1.0	1.0	The goal of a Logic Form Identification (LFi) task is to evaluate the performance of different methods addressing the issue of LFi.	0
62	1456	1456	S04-logic-form-id	Introduction	2	8	2.0	1.0	The Logic Form (LF) that we use is a flat, scope-free first order logic representation that embeds lexical and syntactic information.	0
63	1457	1457	S04-logic-form-id	Introduction	3	9	3.0	1.0	Given a set of English sentences, participating systems were supposed to return the sentences in Logic Form as in the example below.	1
64	1458	1458	S04-logic-form-id	Introduction	4	10	4.0	1.0	The general approach adopted for evaluation was a gold standard approach in which the test data is first correctly mapped onto its corresponding LF by a team of experts and then this correct LF is automatically compared against outputs provided by participating sytems.	0
65	1531	1531	S04-romanian	title	1	1	4.0	1.0	An Evaluation Exercise for Romanian Word Sense Disambiguation	1
66	1532	1532	S04-romanian	abstract	1	2	2.0	1.0	This paper presents the task definition, resources, participating systems, and comparative results for a Romanian Word Sense Disambiguation task, which was organized as part of the SENSEVAL-3 evaluation exercise.	1
67	1533	1533	S04-romanian	abstract	2	3	4.0	1.0	Five teams with a total of seven systems were drawn to this task.	0
68	1607	1607	S04-semantic-roles	The Senseval-3 Task	1	18	1.0	1.0	This Senseval-3 task calls for the development of systems to meet the same objectives as the Gildea and Jurafsky study.	0
69	1608	1608	S04-semantic-roles	The Senseval-3 Task	2	19	1.0	1.0	The data for this task is a sample of the FrameNet hand-annotated data.	0
70	1609	1609	S04-semantic-roles	The Senseval-3 Task	3	20	1.0	1.0	Evaluation of systems is measured using precision and recall of frame elements and overlap of a system's frame element sentence positions with those identified in the FrameNet data.	0
71	1610	1610	S04-semantic-roles	The Senseval-3 Task	4	21	1.0	1.0	The basic task for Senseval-3 is: Given a sentence, a target word and its frame, identify the frame elements within that sentence and tag them with the appropriate frame element name.	1
72	1611	1611	S04-semantic-roles	The Senseval-3 Task	5	22	1.0	1.0	The Frame	0
73	1612	1612	S04-semantic-roles	The Senseval-3 Task	6	23	1.0	1.0	Net project has just released a major revision (FrameNet 1.1) to its database, with 487 frames using 696 distinctly-named frame elements (although it is not guaranteed that frame elements with the same name have the same meaning).	0
74	1613	1613	S04-semantic-roles	The Senseval-3 Task	7	24	1.0	1.0	This release includes 132,968 annotated sentences (mostly taken from the British National Corpus).	0
75	1614	1614	S04-semantic-roles	The Senseval-3 Task	8	25	1.0	1.0	The Senseval-3 task used 8,002 of these sentences selected randomly from 40 frames (also selected randomly) having at least 370 annotations (out of the 100 frames having the most annotations).	0
76	1615	1615	S04-semantic-roles	The Senseval-3 Task	9	26	1.0	2.0	1 Participants were provided with a training set that identified, for each of the 40 frames, the lexical unit identification number (which equates to a file name) and a sentence identification name.	0
77	1616	1616	S04-semantic-roles	The Senseval-3 Task	10	27	1.0	2.0	They were also provided with the answers, i.e., the frame element names and their beginning and ending positions.	0
78	1617	1617	S04-semantic-roles	The Senseval-3 Task	11	28	1.0	2.0	Since the training set was much larger than the test set, participants were required to use the FrameNet 1.1 dataset to obtain the full sentence, its target word, and the tagged frame elements.	0
79	1618	1618	S04-semantic-roles	The Senseval-3 Task	12	29	1.0	2.0	For the test data, participants were provided, for each frame, with sentence instances that identified the lexical unit, the lexical unit identification number, the sentence identification number, the full sentence, and a specification of the target along with its start and end positions.	0
80	1619	1619	S04-semantic-roles	The Senseval-3 Task	13	30	1.0	2.0	Participants were required to submit their answers in a text file, with one answer per line.	0
81	1620	1620	S04-semantic-roles	The Senseval-3 Task	14	31	2.0	2.0	Each line was to identify the frame name and the sentence identifier and then all the frame elements with their start and end positions that their systems were able to identify.	0
82	1621	1621	S04-semantic-roles	The Senseval-3 Task	15	32	2.0	2.0	For example, for the sentence However, its task is made much more difficult by the fact that derogations granted to the Welsh water authority allow &lt;	0
83	1622	1622	S04-semantic-roles	The Senseval-3 Task	16	33	2.0	2.0	Agent&gt;it&lt;/&gt; to &lt;Target&gt;pump&lt;/&gt; &lt;Fluid&gt;raw sewage&lt;/&gt; &lt;Goal&gt;into both those rivers&lt;/&gt;. the correct answer would appear as follows:	0
84	1623	1623	S04-semantic-roles	The Senseval-3 Task	17	34	2.0	2.0	Cause_fluidic_motion.256263 Agent (119,120) Fluid (130,139) Goal (141,162)	0
85	1624	1624	S04-semantic-roles	The Senseval-3 Task	18	35	2.0	2.0	The sentences provided to participants were not presegmented (as defined in the Gildea and Jurafsky study); this was left to the participants' systems.	0
86	1625	1625	S04-semantic-roles	The Senseval-3 Task	19	36	2.0	2.0	The FrameNet dataset contains considerable information that was tagged by the FrameNet lexicographers.	0
87	1626	1626	S04-semantic-roles	The Senseval-3 Task	20	37	2.0	2.0	Participants could use (and were strongly encouraged to use) any and all of the FrameNet data in developing and training their systems.	0
88	1627	1627	S04-semantic-roles	The Senseval-3 Task	21	38	2.0	2.0	In the test, participants could use any of this data, but were strongly encouraged to use only data available in the sentence itself and in the frame that is identified.	0
89	1628	1628	S04-semantic-roles	The Senseval-3 Task	22	39	2.0	2.0	"(This corresponds to the ""more difficult task"" identified by Gildea and Jurafsky.)"	0
90	1629	1629	S04-semantic-roles	The Senseval-3 Task	23	40	2.0	2.0	Participants could submit two runs, one with (non-restrictive case) and one without (restrictive case) using the additional data; these were scored separately.	0
91	1630	1630	S04-semantic-roles	The Senseval-3 Task	24	41	2.0	2.0	Frame	0
92	1631	1631	S04-semantic-roles	The Senseval-3 Task	25	42	2.0	2.0	"Net recognizes the permissibility of ""conceptually salient"" frame elements that have not been instantiated in a sentence; these are called null instantiations (see Johnson et al. for a fuller description)."	0
93	1632	1632	S04-semantic-roles	The Senseval-3 Task	26	43	2.0	2.0	"An example occurs in the following sentence (sentID=""1087911"") from the Motion frame: ""I went and stood in the sitting room doorway, but I couldn't get any further --my legs wouldn't move."""	0
94	1633	1633	S04-semantic-roles	The Senseval-3 Task	27	44	2.0	2.0	In this case, the FrameNet taggers considered the Path frame element to be an indefinite null instantiation (INI).	0
95	1634	1634	S04-semantic-roles	The Senseval-3 Task	28	45	3.0	2.0	Frame elements that have been so designated for a particular sentence appear to be Core frame elements, but not all core frame elements missing from a sentence have designated as null instantiations.	0
96	1635	1635	S04-semantic-roles	The Senseval-3 Task	29	46	3.0	2.0	The correct answer for this case, based on the tagging, is as follows:	0
97	1636	1636	S04-semantic-roles	The Senseval-3 Task	30	47	3.0	2.0	Motion.1087911	0
98	1637	1637	S04-semantic-roles	The Senseval-3 Task	31	48	3.0	2.0	Theme (82,88) Path (0,0)	0
99	1638	1638	S04-semantic-roles	The Senseval-3 Task	32	49	3.0	2.0	Participants were instructed to identify null instantiations in submissions by giving a (0,0) value for the frame element's position.	0
100	1639	1639	S04-semantic-roles	The Senseval-3 Task	33	50	3.0	2.0	2 Participants were told in the task description that null instantiations would be analyzed separately.	0
101	1640	1640	S04-semantic-roles	The Senseval-3 Task	34	51	3.0	3.0	3 For this Senseval task, participants were allowed to download the training data at any time; the 21-day 1 The test set was generated with the Windows-based program FrameNet Explorer, available at http://www.clres.com/SensSemRoles.html.	0
102	1641	1641	S04-semantic-roles	The Senseval-3 Task	35	52	3.0	3.0	FrameNet Explorer provides several facilities for examining the FrameNet data: by frame, frame element, and lexical units.	0
103	1642	1642	S04-semantic-roles	The Senseval-3 Task	36	53	3.0	3.0	For each unit, a user can explore a frame's elements, associated lexical units, frame-to-frame relations, frame and frame element definitions, lexical units and their definitions, and all sentences.	0
104	1643	1643	S04-semantic-roles	The Senseval-3 Task	37	54	3.0	3.0	restriction on submission of results after downloading the training data was waived since this is a new Senseval task and the dataset is very complex.	0
105	1644	1644	S04-semantic-roles	The Senseval-3 Task	38	55	3.0	3.0	Participants could work with the training data as long as they wished.	0
106	1645	1645	S04-semantic-roles	The Senseval-3 Task	39	56	3.0	3.0	The 7-day restriction of submitting results after downloading the test data still applied.	0
107	1646	1646	S04-semantic-roles	The Senseval-3 Task	40	57	3.0	3.0	In general, FrameNet frames contain many frame elements (perhaps an average of 10), most of which are not instantiated in a given sentence.	0
108	1647	1647	S04-semantic-roles	The Senseval-3 Task	41	58	4.0	3.0	Systems were not penalized if they returned more frame elements than those identified by the FrameNet taggers.	0
109	1648	1648	S04-semantic-roles	The Senseval-3 Task	42	59	4.0	3.0	For the 8002 sentences in the test set, only 16212 frame elements constituted the answer set.	0
110	1649	1649	S04-semantic-roles	The Senseval-3 Task	43	60	4.0	3.0	In scoring the runs, each frame element (not a null instantiation) returned by a system was counted as an item attempted.	0
111	1650	1650	S04-semantic-roles	The Senseval-3 Task	44	61	4.0	3.0	If the frame element was one that had been identified by the FrameNet taggers, the answer was scored as correct.	0
112	1651	1651	S04-semantic-roles	The Senseval-3 Task	45	62	4.0	3.0	In addition, however, the scoring program required that the frame boundaries identified by the system's answer had to overlap with the boundaries identified by FrameNet.	0
113	1652	1652	S04-semantic-roles	The Senseval-3 Task	46	63	4.0	3.0	An additional measure of system performance was the degree of overlap.	0
114	1653	1653	S04-semantic-roles	The Senseval-3 Task	47	64	4.0	3.0	If a system's answer coincided exactly to FrameNet's start and end position, the system received an overlap score of 1.0.	0
115	1654	1654	S04-semantic-roles	The Senseval-3 Task	48	65	4.0	3.0	If not, the overlap score was the number of characters overlapping divided by the length of the FrameNet start and end positions (i.e., end-start+1) 4	0
116	1655	1655	S04-semantic-roles	The Senseval-3 Task	49	66	4.0	3.0	The number attempted was the number of nonnull frame elements generated by a system.	0
117	1656	1656	S04-semantic-roles	The Senseval-3 Task	50	67	4.0	3.0	Precision was computed as the number of correct answers divided by the number attempted.	0
118	1657	1657	S04-semantic-roles	The Senseval-3 Task	51	68	4.0	3.0	Recall was computed as the number of correct answers divided by the number of frame elements in the test set.	0
119	1658	1658	S04-semantic-roles	The Senseval-3 Task	52	69	4.0	3.0	Overlap was the average overlap of all correct answers.	0
120	1659	1659	S04-semantic-roles	The Senseval-3 Task	53	70	4.0	3.0	The percent Attempted was the number of frame elements generated divided by the number of frame elements in the test set, multiplied by 100.	0
121	1660	1660	S04-semantic-roles	The Senseval-3 Task	54	71	4.0	3.0	If a system returned frame elements not identified in the test set, its precision would be lower.	0
122	1761	1761	S04-wordnet-glosses	abstract	1	2	1.0	1.0	The SENSEVAL-3 task to perform word-sense disambiguation of WordNet glosses was designed to encourage development of technology to make use of standard lexical resources.	1
123	1762	1762	S04-wordnet-glosses	abstract	2	3	2.0	1.0	The task was based on the availability of sensedisambiguated hand-tagged glosses created in the eXtended WordNet project.	0
124	1763	1763	S04-wordnet-glosses	abstract	3	4	2.0	1.0	"The hand-tagged glosses provided a ""gold standard"" for judging the performance of automated disambiguation systems."	0
125	1764	1764	S04-wordnet-glosses	abstract	4	5	3.0	1.0	Seven teams participated in the task, with a total of 10 runs.	0
126	1765	1765	S04-wordnet-glosses	abstract	5	6	4.0	1.0	"Scoring these runs as an ""all-words"" task, along with considerable discussions among participants, provided more insights than just the underlying technology."	0
127	1766	1766	S04-wordnet-glosses	abstract	6	7	4.0	1.0	The task identified several issues about the nature of the WordNet sense inventory and the underlying use of wordnet design principles, particularly the significance of WordNet-style relations.	0
128	1868	1868	S04-wsd-subcategorization-acq	Introduction	1	5	1.0	1.0	Gold standard evaluation approaches to evaluating word sense disambiguation (WSD) systems often suffer due to the choice of inventory.	0
129	1869	1869	S04-wsd-subcategorization-acq	Introduction	2	6	1.0	1.0	Fundamentally, the sense distinctions (e.g., in WordNet) tend to be very fine-grained which makes the disambiguation task highly difficult.	0
130	1870	1870	S04-wsd-subcategorization-acq	Introduction	3	7	1.0	1.0	Because the best level of sense granularity is likely to be application-dependent, a good alternative is to evaluate WSD systems in a task-based environment.	0
131	1871	1871	S04-wsd-subcategorization-acq	Introduction	4	8	2.0	1.0	We propose task-based evaluation in the context of automatic subcategorization frame (SCF) acquisition where the optimal sense granularity is fairly coarse.	1
132	1872	1872	S04-wsd-subcategorization-acq	Introduction	5	9	2.0	1.0	Automatic subcategorization acquisition is an important NLP task since access to a comprehensive anda ccurate subcategorization lexicon, acquired via automatic means, is vital e.g. for the development of successful parsing technology.	0
133	1873	1873	S04-wsd-subcategorization-acq	Introduction	6	10	2.0	1.0	It is also a suitable task for evaluation of WSD systems because SCF frequencies are known to vary with word senses from one corpus / text type to another.	0
134	1874	1874	S04-wsd-subcategorization-acq	Introduction	7	11	3.0	1.0	While most current systems for subcategorization acquisition are purely syntax-driven and do not employ WSD, Korhonun and Preiss (2003) have recently proposed a method which makes use of word sense.	0
135	1875	1875	S04-wsd-subcategorization-acq	Introduction	8	12	3.0	1.0	This method guides the acquisition process using back-off (i.e., probability) estimates based on verbs different senses in corpora.	0
136	1876	1876	S04-wsd-subcategorization-acq	Introduction	9	13	3.0	1.0	Where the senses are detected correctly, the method improves system performance considerably as the estimates help to correct the acquired SCF distribution and deal with sparse data.	0
137	1877	1877	S04-wsd-subcategorization-acq	Introduction	10	14	4.0	1.0	Our WSD evaluation makes use of this method.	0
