	Unnamed: 0	id	paper_id	headers	local_pos	global_pos	local_pct	global_pct	sentences	labels
596	8416	8416	S13-7	RTE perspective and 2-and 3-way Tasks	13	97	4.0	2.0	The data for those tasks were obtained by automatically collapsing the 5-way labels.	0
597	8417	8417	S13-7	RTE perspective and 2-and 3-way Tasks	14	98	4.0	2.0	In the 3-way task, the systems were required to classify the student answer as either (i) correct; (ii) contradictory; or (iii) incorrect (combining the categories partially correct but incomplete, irrelevant and not in the domain from the 5-way classification).	0
598	8418	8418	S13-7	RTE perspective and 2-and 3-way Tasks	15	99	4.0	2.0	In the two-way task, the systems were required to classify the student answer as either correct or incorrect (combining the categories contradictory and incorrect from the 3-way classification)	0
599	8723	8723	S13-9	abstract	1	2	1.0	1.0	The DDIExtraction 2013 task concerns the recognition of drugs and extraction of drugdrug interactions that appear in biomedical literature.	1
600	8724	8724	S13-9	abstract	2	3	2.0	1.0	We propose two subtasks for the DDIExtraction 2013 Shared Task challenge: 1) the recognition and classification of drug names and 2) the extraction and classification of their interactions.	0
601	8725	8725	S13-9	abstract	3	4	3.0	1.0	Both subtasks have been very successful in participation and results.	0
602	8726	8726	S13-9	abstract	4	5	4.0	1.0	There were 14 teams who submitted a total of 38 runs.	0
603	8727	8727	S13-9	abstract	5	6	4.0	1.0	The best result reported for the first subtask was F1 of 71.5% and 65.1% for the second one.	0
604	9204	9204	S13-12	Task Setup	1	25	2.0	1.0	The task required participating systems to annotate nouns in a test corpus with the most appropriate sense from the BabelNet sense inventory or, alternatively, from two main subsets of it, namely the WordNet or Wikipedia sense inventories.	1
605	9205	9205	S13-12	Task Setup	2	26	4.0	1.0	In contrast to previous all-words WSD tasks we did not focus on the other three open classes (i.e., verbs, adjectives and adverbs) since BabelNet does not currently provide non-English coverage for them.	0
606	9582	9582	S14-1	The Task	1	23	1.0	1.0	The Task involved two subtasks.	1
607	9583	9583	S14-1	The Task	2	24	1.0	1.0	(i) Relatedness: predicting the degree of semantic similarity between two sentences, and (ii) Entailment: detecting the entailment relation holding between them (see below for the exact definition).	1
608	9584	9584	S14-1	The Task	3	25	1.0	1.0	Sentence relatedness scores provide a direct way to evaluate CDSMs, insofar as their outputs are able to quantify the degree of semantic similarity between sentences.	0
609	9585	9585	S14-1	The Task	4	26	2.0	1.0	On the other hand, starting from the assumption that understanding a sentence means knowing when it is true, being able to verify whether an entailment is valid is a crucial challenge for semantic systems.	0
610	9586	9586	S14-1	The Task	5	27	2.0	1.0	In the semantic relatedness subtask, given two sentences, systems were required to produce a relatedness score (on a continuous scale) indicating the extent to which the sentences were expressing a related meaning.	0
611	9587	9587	S14-1	The Task	6	28	2.0	1.0	Table 1 shows examples of sentence pairs with different degrees of semantic relatedness; gold relatedness scores are expressed on a 5-point rating scale.	0
612	9588	9588	S14-1	The Task	7	29	3.0	1.0	In the entailment subtask, given two sentences A and B, systems had to determine whether the meaning of B was entailed by A.	0
613	9589	9589	S14-1	The Task	8	30	3.0	1.0	In particular, systems were required to assign to each pair either the ENTAILMENT label (when A entails B, viz., B cannot be false when A is true), the CONTRA-DICTION label (when A contradicted B, viz.	0
614	9590	9590	S14-1	The Task	9	31	3.0	1.0	B is false whenever A is true), or the NEUTRAL label (when the truth of B could not be determined on the basis of A).	0
615	9591	9591	S14-1	The Task	10	32	4.0	1.0	Table 2 shows examples of sentence pairs holding different entailment relations.	0
616	9592	9592	S14-1	The Task	11	33	4.0	1.0	Participants were invited to submit up to five system runs for one or both subtasks.	0
617	9593	9593	S14-1	The Task	12	34	4.0	2.0	Developers of CDSMs were especially encouraged to participate, but developers of other systems that could tackle sentence relatedness or entailment tasks were also welcome.	0
618	9594	9594	S14-1	The Task	13	35	4.0	2.0	Besides being of intrinsic interest, the latter systems' performance will serve to situate CDSM performance within the broader landscape of computational semantics.	0
619	9694	9694	S14-2	abstract	1	2	1.0	1.0	In this paper we present the SemEval-2014	0
620	9695	9695	S14-2	abstract	2	3	1.0	1.0	Task 2 on spoken dialogue grammar induction.	0
621	9696	9696	S14-2	abstract	3	4	2.0	1.0	The task is to classify a lexical fragment to the appropriate semantic category (grammar rule) in order to construct a grammar for spoken dialogue systems.	1
622	9697	9697	S14-2	abstract	4	5	2.0	1.0	We describe four subtasks covering two languages, English and Greek, and three speech application domains, travel reservation, tourism and finance.	0
623	9698	9698	S14-2	abstract	5	6	3.0	1.0	The classification results are compared against the groundtruth.	0
624	9699	9699	S14-2	abstract	6	7	3.0	1.0	Weighted and unweighted precision, recall and fmeasure are reported.	0
625	9700	9700	S14-2	abstract	7	8	4.0	1.0	Three sites participated in the task with five systems, employing a variety of features and in some cases using external resources for training.	0
626	9701	9701	S14-2	abstract	8	9	4.0	1.0	The submissions manage to significantly beat the baseline, achieving a f-measure of 0.69 in comparison to 0.56 for the baseline, averaged across all subtasks.	0
627	9894	9894	S14-3	Introduction	1	7	1.0	1.0	Given two linguistic items, semantic similarity measures the degree to which the two items have the same meaning.	0
628	9895	9895	S14-3	Introduction	2	8	1.0	1.0	Semantic similarity is an essential component of many applications in Natural Language Processing (NLP), and similarity measurements between all types of text as well as between word senses lend themselves to a variety of NLP tasks such as information retrieval (Hliaoutakis et al., 2006) or paraphrasing (Glickman and Dagan, 2003).	0
629	9896	9896	S14-3	Introduction	3	9	1.0	1.0	Semantic similarity evaluations have largely focused on comparing similar types of lexical items.	0
630	9897	9897	S14-3	Introduction	4	10	1.0	1.0	Most recently, tasks in SemEval (Agirre et al., 2012) and *SEM (Agirre et al., 2013) have introduced benchmarks for measuring Semantic Textual Similarity (STS) between similar-sized sentences and phrases.	0
631	9898	9898	S14-3	Introduction	5	11	1.0	1.0	Other data sets such as that This work is licensed under a Creative Commons Attribution 4.0 International License.	0
632	9899	9899	S14-3	Introduction	6	12	2.0	1.0	Page numbers and proceedings footer are added by the organizers.	0
633	9900	9900	S14-3	Introduction	7	13	2.0	1.0	License details: http: //creativecommons.org/licenses/by/4.0/ of Rubenstein and Goodenough (1965) measure similarity between word pairs, while the data sets of Navigli (2006) and Kilgarriff (2001) offer a binary similar-dissimilar distinction between senses.	0
634	9901	9901	S14-3	Introduction	8	14	2.0	1.0	Notably, all of these evaluations have focused on comparisons between a single type, in contrast to application-based evaluations such as summarization and compositionality which incorporate textual items of different sizes, e.g., measuring the quality of a paragraph's sentence summarization.	0
635	9902	9902	S14-3	Introduction	9	15	2.0	1.0	Task 3 introduces a new evaluation where similarity is measured between items of different types: paragraphs, sentences, phrases, words and senses.	0
636	9903	9903	S14-3	Introduction	10	16	2.0	1.0	Given an item of the lexically-larger type, a system measures the degree to which the meaning of the larger item is captured in the smaller type, e.g., comparing a paragraph to a sentence.	1
637	9904	9904	S14-3	Introduction	11	17	3.0	1.0	We refer to this task as Cross-Level Semantic Similarity (CLSS).	0
638	9905	9905	S14-3	Introduction	12	18	3.0	1.0	A major motivation of this task is to produce semantic similarity systems that are able to compare all types of text, thereby freeing downstream NLP applications from needing to consider the type of text being compared.	0
639	9906	9906	S14-3	Introduction	13	19	3.0	1.0	"Task 3 enables assessing the extent to which the meaning of the sentence ""do u know where i can watch free older movies online without download?"" is captured in the phrase ""streaming vintage movies for free"", or how similar is ""circumscribe"" to the phrase ""beating around the bush."""	0
640	9907	9907	S14-3	Introduction	14	20	3.0	1.0	Furthermore, by incorporating comparisons of a variety of item sizes, Task 3 unifies in a single task multiple objectives from different areas of NLP such as paraphrasing, summarization, and compositionality.	0
641	9908	9908	S14-3	Introduction	15	21	3.0	1.0	Because CLSS generalizes STS to items of different types, successful CLSS systems can directly be applied to all STS-based applications.	0
642	9909	9909	S14-3	Introduction	16	22	4.0	1.0	Furthermore, CLSS systems can be used in other similarity-based applications such as text simplification (Specia et al., 2012), keyphrase identification (Kim et al., 2010), lexical substitution (McCarthy andNavigli, 2009), summariza-tion (Sprck Jones, 2007), gloss-to-sense mapping (Pilehvar and Navigli, 2014b), and modeling the semantics of multi-word expressions (Marelli et al., 2014) or polysemous words (Pilehvar and Navigli, 2014a).	0
643	9910	9910	S14-3	Introduction	17	23	4.0	1.0	Task 3 was designed with three main objectives.	0
644	9911	9911	S14-3	Introduction	18	24	4.0	1.0	First, the task should include multiple types of comparison in order to assess each type's difficulty and whether specialized resources are needed for each.	0
645	9912	9912	S14-3	Introduction	19	25	4.0	1.0	Second, the task should incorporate text from multiple domains and writing styles to ensure that system performance is robust across text types.	0
646	9913	9913	S14-3	Introduction	20	26	4.0	1.0	Third, the similarity methods should be able to operate at the sense level, thereby potentially uniting text-and sense-based similarity methods within a single framework.	0
647	10103	10103	S14-4	abstract	1	2	1.0	1.0	Sentiment analysis is increasingly viewed as a vital task both from an academic and a commercial standpoint.	0
648	10104	10104	S14-4	abstract	2	3	2.0	1.0	The majority of current approaches, however, attempt to detect the overall polarity of a sentence, paragraph, or text span, irrespective of the entities mentioned (e.g., laptops) and their aspects (e.g., battery, screen).	0
649	10105	10105	S14-4	abstract	3	4	2.0	1.0	SemEval-2014	0
650	10106	10106	S14-4	abstract	4	5	3.0	1.0	Task 4 aimed to foster research in the field of aspect-based sentiment analysis, where the goal is to identify the aspects of given target entities and the sentiment expressed for each aspect.	1
651	10107	10107	S14-4	abstract	5	6	4.0	1.0	The task provided datasets containing manually annotated reviews of restaurants and laptops, as well as a common evaluation procedure.	0
652	10108	10108	S14-4	abstract	6	7	4.0	1.0	It attracted 163 submissions from 32 teams.	0
653	10305	10305	S14-5	Introduction	1	6	1.0	1.0	We present a new cross-lingual and applicationoriented task for SemEval that is situated in the area where Word Sense Disambiguation and Machine Translation meet.	0
654	10306	10306	S14-5	Introduction	2	7	1.0	1.0	Finding the proper translation of a word or phrase in a given context is much like the problem of disambiguating between multiple senses.	0
655	10307	10307	S14-5	Introduction	3	8	2.0	1.0	In this task participants are asked to build a translation/writing assistance system that translates specifically marked L1 fragments in an L2 context to their proper L2 translation.	1
656	10308	10308	S14-5	Introduction	4	9	2.0	1.0	This type of translation can be applied in writing assistance systems for language learners in which users write in a target language, but are allowed to occasionally back off to their native L1 when they are uncertain of the proper lexical or grammatical form in L2.	0
657	10309	10309	S14-5	Introduction	5	10	3.0	1.0	The task concerns the NLP back-end rather than any user interface.	0
658	10310	10310	S14-5	Introduction	6	11	3.0	1.0	Full-on machine translation typically concerns the translation of complete sentences or texts from L1 to L2.	0
659	10311	10311	S14-5	Introduction	7	12	4.0	1.0	This task, in contrast, focuses on smaller fragments, side-tracking the problem of full word reordering.	0
660	10312	10312	S14-5	Introduction	8	13	4.0	1.0	We focus on the following language combinations of L1 and L2 pairs: English-German, English-Spanish, French-English and Dutch-English.	0
661	10313	10313	S14-5	Introduction	9	14	4.0	1.0	Task participants could participate for all language pairs or any subset thereof.	0
662	10685	10685	S14-7	abstract	1	2	1.0	1.0	This paper describes the SemEval-2014, Task 7 on the Analysis of Clinical Text and presents the evaluation results.	0
663	10686	10686	S14-7	abstract	2	3	2.0	1.0	It focused on two subtasks: (i) identification (Task A) and (ii) normalization (Task B) of diseases and disorders in clinical reports as annotated in the Shared Annotated Resources (ShARe) 1 corpus.	1
664	10687	10687	S14-7	abstract	3	4	2.0	1.0	This task was a follow-up to the ShARe/CLEF eHealth 2013 shared task, subtasks 1a and 1b, 2 but using a larger test set.	0
665	10688	10688	S14-7	abstract	4	5	3.0	1.0	A total of 21 teams competed in Task A, and 18 of those also participated in Task B. For Task A, the best system had a strict F 1 -score of 81.3, with a precision of 84.3 and recall of 78.6.	0
666	10689	10689	S14-7	abstract	5	6	3.0	1.0	For Task B, the same group had the best strict accuracy of 74.1.	0
667	10690	10690	S14-7	abstract	6	7	4.0	1.0	The organizers have made the text corpora, annotations, and evaluation tools available for future research and development at the shared task website.	0
668	10691	10691	S14-7	abstract	7	8	4.0	1.0	3 evaluation 3	0
669	10843	10843	S14-8	abstract	1	2	2.0	1.0	Task 8 at SemEval 2014 defines Broad-Coverage Semantic Dependency Parsing (SDP) as the problem of recovering sentence-internal predicate-argument relationships for all content words, i.e. the semantic structure constituting the relational core of sentence meaning.	1
670	10844	10844	S14-8	abstract	2	3	4.0	1.0	In this task description, we position the problem in comparison to other sub-tasks in computational language analysis, introduce the semantic dependency target representations used, reflect on high-level commonalities and differences between these representations, and summarize the task setup, participating systems, and main results.	0
671	11153	11153	S14-10	abstract	1	2	1.0	1.0	In Semantic Textual Similarity, systems rate the degree of semantic equivalence between two text snippets.	1
672	11154	11154	S14-10	abstract	2	3	2.0	1.0	This year, the participants were challenged with new data sets for English, as well as the introduction of Spanish, as a new language in which to assess semantic similarity.	0
673	11155	11155	S14-10	abstract	3	4	2.0	1.0	For the English subtask, we exposed the systems to a diversity of testing scenarios, by preparing additional OntoNotes-Word	0
674	11156	11156	S14-10	abstract	4	5	3.0	1.0	Net sense mappings and news headlines, as well as introducing new genres, including image descriptions, DEFT discussion forums, DEFT newswire, and tweet-newswire headline mappings.	0
675	11157	11157	S14-10	abstract	5	6	3.0	1.0	For Spanish, since, to our knowledge, this is the first time that official evaluations are conducted, we used well-formed text, by featuring sentences extracted from encyclopedic content and newswire.	0
676	11158	11158	S14-10	abstract	6	7	4.0	1.0	The annotations for both tasks leveraged crowdsourcing.	0
677	11159	11159	S14-10	abstract	7	8	4.0	1.0	The Spanish subtask engaged 9 teams participating with 22 system runs, and the English subtask attracted 15 teams with 38 system runs.	0
678	11389	11389	S15-1	abstract	1	2	1.0	1.0	In this shared task, we present evaluations on two related tasks Paraphrase Identification (PI) and Semantic Textual Similarity (SS) systems for the Twitter data.	0
679	11390	11390	S15-1	abstract	2	3	1.0	1.0	Given a pair of sentences, participants are asked to produce a binary yes/no judgement or a graded score to measure their semantic equivalence.	1
680	11391	11391	S15-1	abstract	3	4	2.0	1.0	The task features a newly constructed Twitter Paraphrase Corpus that contains 18,762 sentence pairs.	0
681	11392	11392	S15-1	abstract	4	5	2.0	1.0	A total of 19 teams participated, submitting 36 runs to the PI task and 26 runs to the SS task.	0
682	11393	11393	S15-1	abstract	5	6	3.0	1.0	The evaluation shows encouraging results and open challenges for future research.	0
683	11394	11394	S15-1	abstract	6	7	3.0	1.0	The best systems scored a F1-measure of 0.674 for the PI task and a Pearson correlation of 0.619 for the SS task respectively, comparing to a strong baseline using logistic regression model of 0.589 F1 and 0.511 Pearson; while the best SS systems can often reach &gt;0.80 Pearson on well-formed text.	0
684	11395	11395	S15-1	abstract	7	8	4.0	1.0	This shared task also provides insights into the relation between the PI and SS tasks and suggests the importance to bringing these two research areas together.	0
685	11396	11396	S15-1	abstract	8	9	4.0	1.0	We make all the data, baseline systems and evaluation scripts publicly available.	0
686	11397	11397	S15-1	abstract	9	10	4.0	1.0	1	0
687	11555	11555	S15-2	abstract	1	2	1.0	1.0	In semantic textual similarity (STS), systems rate the degree of semantic equivalence between two text snippets.	1
688	11556	11556	S15-2	abstract	2	3	2.0	1.0	This year, the participants were challenged with new datasets in English and Spanish.	0
689	11557	11557	S15-2	abstract	3	4	2.0	1.0	The annotations for both subtasks leveraged crowdsourcing.	0
690	11558	11558	S15-2	abstract	4	5	3.0	1.0	The English subtask attracted 29 teams with 74 system runs, and the Spanish subtask engaged 7 teams participating with 16 system runs.	0
691	11559	11559	S15-2	abstract	5	6	3.0	1.0	In addition, this year we ran a pilot task on interpretable STS, where the systems needed to add an explanatory layer, that is, they had to align the chunks in the sentence pair, explicitly annotating the kind of relation and the score of the chunk pair.	0
692	11560	11560	S15-2	abstract	6	7	4.0	1.0	The train and test data were manually annotated by an expert, and included headline and image sentence pairs from previous years.	0
693	11561	11561	S15-2	abstract	7	8	4.0	1.0	7 teams participated with 29 runs.	0
694	11830	11830	S15-3	abstract	1	2	1.0	1.0	Community Question Answering (cQA) provides new interesting research directions to the traditional Question Answering (QA) field, e.g., the exploitation of the interaction between users and the structure of related posts.	0
695	11831	11831	S15-3	abstract	2	3	2.0	1.0	In this context, we organized SemEval-2015 Task 3 on Answer Selection in cQA, which included two subtasks: (a) classifying answers as good, bad, or potentially relevant with respect to the question, and (b) answering a YES/NO question with yes, no, or unsure, based on the list of all answers.	1
696	11832	11832	S15-3	abstract	3	4	2.0	1.0	We set subtask A for Arabic and English on two relatively different cQA domains, i.e., the Qatar Living website for English, and a Quran-related website for Arabic.	0
697	11833	11833	S15-3	abstract	4	5	3.0	1.0	We used crowdsourcing on Amazon Mechanical Turk to label a large English training dataset, which we released to the research community.	0
698	11834	11834	S15-3	abstract	5	6	4.0	1.0	Thirteen teams participated in the challenge with a total of 61 submissions: 24 primary and 37 contrastive.	0
699	11835	11835	S15-3	abstract	6	7	4.0	1.0	The best systems achieved an official score (macro-averaged F 1 ) of 57.19 and 63.7 for the English subtasks A and B, and 78.55 for the Arabic subtask A.	0
700	12062	12062	S15-4	abstract	1	2	1.0	1.0	This paper describes the outcomes of the TimeLine task (Cross-Document Event Ordering), that was organised within the Time and Space track of SemEval-2015.	0
701	12063	12063	S15-4	abstract	2	3	2.0	1.0	Given a set of documents and a set of target entities, the task consisted of building a timeline for each entity, by detecting, anchoring in time and ordering the events involving that entity.	1
702	12064	12064	S15-4	abstract	3	4	3.0	1.0	The TimeLine task goes a step further than previous evaluation challenges by requiring participant systems to perform both event coreference and temporal relation extraction across documents.	0
703	12065	12065	S15-4	abstract	4	5	4.0	1.0	Four teams submitted the output of their systems to the four proposed subtracks for a total of 13 runs, the best of which obtained an F 1 -score of 7.85 in the main track (timeline creation from raw text).	0
704	12270	12270	S15-5	Task Description	1	27	1.0	1.0	The task for participant systems is equivalent to TempEval-3 task ABC, see Figure 1.	0
705	12271	12271	S15-5	Task Description	2	28	1.0	1.0	Systems must annotate temporal expressions, events, and temporal relations between them 1 .	1
706	12272	12272	S15-5	Task Description	3	29	2.0	1.0	The input to participants is a set of unannotated text documents in TempEval-3 format.	0
707	12273	12273	S15-5	Task Description	4	30	2.0	1.0	Participating systems are required to annotate the plain documents following the TimeML scheme, divided into two types of elements:	0
708	12274	12274	S15-5	Task Description	5	31	3.0	1.0	" Temporal entities: These include events (EVENT tag, ""came"", ""attack"") and temporal expressions (timexes, TIMEX3 tag, e.g., ""yesterday"", ""8 p.m."") as well as their attributes like event class, timex type, and normalized values."	0
709	12275	12275	S15-5	Task Description	6	32	3.0	1.0	 (1) John was in the gym between 6:00 p.m and 7:00 p.m.	0
710	12276	12276	S15-5	Task Description	7	33	4.0	1.0	Each system's annotations represent its temporal knowledge of the documents.	0
711	12277	12277	S15-5	Task Description	8	34	4.0	1.0	These annotations are 1 http://alt.qcri.org/semeval2015/task5	0
712	12278	12278	S15-5	Task Description	9	35	4.0	1.0	Figure 1: Task -Equivalent to TempEval-3 task ABC then used as input to a temporal QA system (Uz-Zaman et al., 2012) that will answer questions on behalf of the systems, and the accuracy of their answers is compared across systems.	0
713	12592	12592	S15-7	abstract	1	2	1.0	1.0	In this paper we describe a novel task, namely the Diachronic Text Evaluation task.	0
714	12593	12593	S15-7	abstract	2	3	2.0	1.0	A corpus of snippets which contain relevant information for the time when the text was created is extracted from a large collection of newspapers published between 1700 and 2010.	0
715	12594	12594	S15-7	abstract	3	4	2.0	1.0	The task, subdivided in three subtasks, requires the automatic system to identify the time interval when the piece of news was written.	1
716	12595	12595	S15-7	abstract	4	5	3.0	1.0	The subtasks concern specific type of information that might be available in news.	0
717	12596	12596	S15-7	abstract	5	6	4.0	1.0	The intervals come in three grades: fine, medium and coarse according to their length.	0
718	12597	12597	S15-7	abstract	6	7	4.0	1.0	The systems participating in the tasks have proved that this a doable task with very interesting possible continuations.	0
719	12852	12852	S15-8	The Task	1	31	4.0	1.0	The goals of SpaceEval include identifying and classifying items from an inventory of spatial concepts:	1
720	12980	12980	S15-9	Introduction	1	7	1.0	1.0	Current research in sentiment analysis (SA, henceforth) is mostly focused on lexical resources that store polarity values.	0
721	12981	12981	S15-9	Introduction	2	8	1.0	1.0	For bag-of-words approaches the polarity of a text depends on the presence/absence of a set of lexical items.	0
722	12982	12982	S15-9	Introduction	3	9	1.0	1.0	This methodology is successful to detect opinions about entities (such as reviews) but it shows mixed results when complex opinions about events -involving perspectives and points of view -are expressed.	0
723	12983	12983	S15-9	Introduction	4	10	2.0	1.0	In terms of parts of speech involved, SA approaches tend to focus on lexical items that explicitly convey opinions -mainly adjectives, adverbs and several nouns -leaving verbs on the foreground.	0
724	12984	12984	S15-9	Introduction	5	11	2.0	1.0	Improvements have been proposed by taking into account syntax (Greene and Resnik 2009) and by investigating the connotative polarity of words (Cambria et al., 2009;	0
725	12985	12985	S15-9	Introduction	6	12	2.0	1.0	Akkaya et al., 2009, Balhaur et al., 2011	0
726	12986	12986	S15-9	Introduction	7	13	3.0	1.0	Russo et al. 2011;Cambria et al., 2012, Deng et al., 2013.	0
727	12987	12987	S15-9	Introduction	8	14	3.0	1.0	One of the key aspects of sentiment analysis, which has been only marginally tackled so far, is the identification of implicit polarity.	0
728	12988	12988	S15-9	Introduction	9	15	3.0	1.0	By implicit polarity we refer to the recognition of subjective textual units where no polarity markers are present but still people are able to state whether the text portion under analysis expresses a positive or negative sentiment.	0
729	12989	12989	S15-9	Introduction	10	16	4.0	1.0	Recently, methodologies trying to address this aspect have been developed, incorporating ideas from linguistic and psychological studies on the subjective aspects of linguistic expressions.	0
