	Unnamed: 0	id	paper_id	headers	local_pos	global_pos	local_pct	global_pct	sentences	labels
2006	34850	34850	W05-0620	Introduction	25	28	3.0	1.0	In order to test the robustness of the presented systems, a cross-corpora evaluation is performed using a fresh test set from the Brown corpus.	0
2007	34851	34851	W05-0620	Introduction	26	29	4.0	1.0	Regarding evaluation, two different settings were devised depending if the systems use the information strictly contained in the training data (closed challenge) or they make use of external sources of information and/or tools (open challenge).	0
2008	34852	34852	W05-0620	Introduction	27	30	4.0	1.0	The closed setting allows to compare systems under strict conditions, while the open setting aimed at exploring the contributions of other sources of information and the limits of the current learning-based systems on the SRL task.	0
2009	34853	34853	W05-0620	Introduction	28	31	4.0	1.0	At the end, all 19 systems took part in the closed challenge and none of them in the open challenge.	0
2010	34854	34854	W05-0620	Introduction	29	32	4.0	1.0	The rest of the paper is organized as follows.	0
2011	34855	34855	W05-0620	Introduction	30	33	4.0	1.0	Section 2 describes the general setting of the task.	0
2012	34856	34856	W05-0620	Introduction	31	34	4.0	1.0	Section 3 provides a detailed description of training, development and test data.	0
2013	34857	34857	W05-0620	Introduction	32	35	4.0	1.0	Participant systems are described and compared in section 4.	0
2014	34858	34858	W05-0620	Introduction	33	36	4.0	1.0	In particular, information about learning techniques, SRL strategies, and feature development is provided, together with performance results on the development and test sets.	0
2015	34859	34859	W05-0620	Introduction	34	37	4.0	1.0	Finally, section 5 concludes.	0
2016	35128	35128	D07-1096	Introduction	1	6	1.0	1.0	Previous shared tasks of the Conference on Computational Natural Language Learning (CoNLL) have been devoted to chunking (1999,2000), clause identification (2001), named entity recognition (2002,2003), and semantic role labeling (2004,2005).	0
2017	35129	35129	D07-1096	Introduction	2	7	1.0	1.0	In 2006 the shared task was multilingual dependency parsing, where participants had to train a single parser on data from thirteen different languages, which enabled a comparison not only of parsing and learning methods, but also of the performance that can be achieved for different languages (Buchholz and Marsi, 2006).	0
2018	35130	35130	D07-1096	Introduction	3	8	2.0	1.0	In dependency-based syntactic parsing, the task is to derive a syntactic structure for an input sentence by identifying the syntactic head of each word in the sentence.	1
2019	35131	35131	D07-1096	Introduction	4	9	2.0	1.0	This defines a dependency graph, where the nodes are the words of the input sentence and the arcs are the binary relations from head to dependent.	0
2020	35132	35132	D07-1096	Introduction	5	10	2.0	1.0	Often, but not always, it is assumed that all words except one have a syntactic head, which means that the graph will be a tree with the single independent word as the root.	0
2021	35133	35133	D07-1096	Introduction	6	11	3.0	1.0	In labeled dependency parsing, we additionally require the parser to assign a specific type (or label) to each dependency relation holding between a head word and a dependent word.	0
2022	35134	35134	D07-1096	Introduction	7	12	3.0	1.0	In this year's shared task, we continue to explore data-driven methods for multilingual dependency parsing, but we add a new dimension by also introducing the problem of domain adaptation.	0
2023	35135	35135	D07-1096	Introduction	8	13	3.0	1.0	The way this was done was by having two separate tracks: a multilingual track using essentially the same setup as last year, but with partly different languages, and a domain adaptation track, where the task was to use machine learning to adapt a parser for a single language to a new domain.	0
2024	35136	35136	D07-1096	Introduction	9	14	4.0	1.0	In total, test results were submitted for twenty-three systems in the multilingual track, and ten systems in the domain adaptation track (six of which also participated in the multilingual track).	0
2025	35137	35137	D07-1096	Introduction	10	15	4.0	1.0	Not everyone submitted papers describing their system, and some papers describe more than one system (or the same system in both tracks), which explains why there are only (!) twenty-one papers in the proceedings.	0
2026	35138	35138	D07-1096	Introduction	11	16	4.0	1.0	In this paper, we provide task definitions for the two tracks (section 2), describe data sets extracted from available treebanks (section 3), report results for all systems in both tracks (section 4), give an overview of approaches used (section 5), provide a first analysis of the results (section 6), and conclude with some future directions (section 7).	0
2027	35516	35516	W08-2121	Introduction	1	7	1.0	1.0	In 2004 and 2005 the shared tasks of the Conference on Computational Natural Language Learning (CoNLL) were dedicated to semantic role labeling (SRL), in a monolingual setting (English).	0
2028	35517	35517	W08-2121	Introduction	2	8	1.0	1.0	In 2006 and 2007 the shared tasks were devoted to the parsing of syntactic dependencies, using corpora from up to 13 languages.	0
2029	35518	35518	W08-2121	Introduction	3	9	1.0	1.0	The CoNLL-2008 shared task 1 proposes a unified dependency-based c 2008.	0
2030	35519	35519	W08-2121	Introduction	4	10	1.0	1.0	Licensed under the Creative Commons Attribution-Noncommercial-Share Alike 3.0 Unported license (http://creativecommons.org/licenses/by-nc-sa/3.0/).	0
2031	35520	35520	W08-2121	Introduction	5	11	1.0	1.0	Some rights reserved.	0
2032	35521	35521	W08-2121	Introduction	6	12	1.0	1.0	1 http://www.yr-bcn.es/conll2008	0
2033	35522	35522	W08-2121	Introduction	7	13	2.0	1.0	formalism, which models both syntactic dependencies and semantic roles.	0
2034	35523	35523	W08-2121	Introduction	8	14	2.0	1.0	Using this formalism, this shared task merges both the task of syntactic dependency parsing and the task of identifying semantic arguments and labeling them with semantic roles.	0
2035	35524	35524	W08-2121	Introduction	9	15	2.0	1.0	Conceptually, the 2008 shared task can be divided into three subtasks: (i) parsing of syntactic dependencies, (ii) identification and disambiguation of semantic predicates, and (iii) identification of arguments and assignment of semantic roles for each predicate.	1
2036	35525	35525	W08-2121	Introduction	10	16	2.0	1.0	Several objectives were addressed in this shared task:	0
2037	35526	35526	W08-2121	Introduction	11	17	2.0	1.0	 SRL is performed and evaluated using a dependency-based representation for both syntactic and semantic dependencies.	0
2038	35527	35527	W08-2121	Introduction	12	18	2.0	1.0	While SRL on top of a dependency treebank has been addressed before (Hacioglu, 2004), our approach has several novelties: (i) our constituent-to-dependency conversion strategy transforms all annotated semantic arguments in PropBank and NomBank not just a subset; (ii) we address propositions centered around both verbal (PropBank) and nominal (NomBank) predicates.	0
2039	35528	35528	W08-2121	Introduction	13	19	2.0	1.0	 Based on the observation that a richer set of syntactic dependencies improves semantic processing (Johansson and Nugues, 2007), the syntactic dependencies modeled are more complex than the ones used in the previous CoNLL shared tasks.	0
2040	35529	35529	W08-2121	Introduction	14	20	3.0	1.0	For example, we now include apposition links, dependencies derived from named entity (NE) structures, and better modeling of long-distance grammatical relations.	0
2041	35530	35530	W08-2121	Introduction	15	21	3.0	1.0		0
2042	35531	35531	W08-2121	Introduction	16	22	3.0	1.0	A practical framework is provided for the joint learning of syntactic and semantic dependencies.	0
2043	35532	35532	W08-2121	Introduction	17	23	3.0	1.0	Given the complexity of this shared task, we limited the evaluation to a monolingual, Englishonly setting.	0
2044	35533	35533	W08-2121	Introduction	18	24	3.0	1.0	The evaluation is separated into two different challenges: a closed challenge, where systems have to be trained strictly with information contained in the given training corpus, and an open challenge, where systems can be developed making use of any kind of external tools and resources.	0
2045	35534	35534	W08-2121	Introduction	19	25	3.0	1.0	The participants could submit results in either one or both challenges.	0
2046	35535	35535	W08-2121	Introduction	20	26	4.0	1.0	This paper is organized as follows.	0
2047	35536	35536	W08-2121	Introduction	21	27	4.0	1.0	Section 2 defines the task, including the format of the data, the evaluation metrics, and the two challenges.	0
2048	35537	35537	W08-2121	Introduction	22	28	4.0	1.0	Section 3 introduces the corpora used and our constituent-to-dependency conversion procedure.	0
2049	35538	35538	W08-2121	Introduction	23	29	4.0	1.0	Section 4 summarizes the results of the submitted systems.	0
2050	35539	35539	W08-2121	Introduction	24	30	4.0	1.0	Section 5 discusses the approaches implemented by participants.	0
2051	35540	35540	W08-2121	Introduction	25	31	4.0	1.0	Section 6 analyzes the results using additional non-official evaluation measures.	0
2052	35541	35541	W08-2121	Introduction	26	32	4.0	1.0	Section 7 concludes the paper.	0
2053	35863	35863	W09-1201	Introduction	1	6	1.0	1.0	"Every year since 1999, the Conference on Computational Natural Language Learning (CoNLL) launches a competitive, open ""Shared Task""."	0
2054	35864	35864	W09-1201	Introduction	2	7	1.0	1.0	"A common (""shared"") task is defined and datasets are provided for its participants."	0
2055	35865	35865	W09-1201	Introduction	3	8	1.0	1.0	In 2004 and 2005, the shared tasks were dedicated to semantic role labeling (SRL) in a monolingual setting (English).	0
2056	35866	35866	W09-1201	Introduction	4	9	1.0	1.0	In 2006 and 2007 the shared tasks were devoted to the parsing of syntactic dependencies, using corpora from up to 13 languages.	0
2057	35867	35867	W09-1201	Introduction	5	10	1.0	1.0	In 2008, the shared task (Surdeanu et al., 2008) used a unified dependencybased formalism, which modeled both syntactic dependencies and semantic roles for English.	0
2058	35868	35868	W09-1201	Introduction	6	11	1.0	1.0	The CoNLL-2009 Shared Task has built on the 2008 results by providing data for six more languages (Catalan, Chinese, Czech, German, Japanese and Spanish) in addition to the original English 1 .	0
2059	35869	35869	W09-1201	Introduction	7	12	2.0	1.0	It has thus naturally extended the path taken by the five most recent CoNLL shared tasks.	0
2060	35870	35870	W09-1201	Introduction	8	13	2.0	1.0	As in 2008, the CoNLL-2009 shared task combined dependency parsing and the task of identifying and labeling semantic arguments of verbs (and other parts of speech whenever available).	1
2061	35871	35871	W09-1201	Introduction	9	14	2.0	1.0	Participants had to choose from two tasks:	0
2062	35872	35872	W09-1201	Introduction	10	15	2.0	1.0		0
2063	35873	35873	W09-1201	Introduction	11	16	2.0	1.0	Joint task (syntactic dependency parsing and semantic role labeling), or	0
2064	35874	35874	W09-1201	Introduction	12	17	2.0	1.0	 SRL-only task (syntactic dependency parses have been provided by the organizers, using state-of-the art parsers for the individual languages).	0
2065	35875	35875	W09-1201	Introduction	13	18	3.0	1.0	In contrast to the previous year, the evaluation data indicated which words were to be dealt with (for the SRL task).	0
2066	35876	35876	W09-1201	Introduction	14	19	3.0	1.0	In other words, (predicate) disambiguation was still part of the task, whereas the identification of argument-bearing words was not.	0
2067	35877	35877	W09-1201	Introduction	15	20	3.0	1.0	This decision was made to compensate for the significant differences between languages and between the annotation schemes used.	0
2068	35878	35878	W09-1201	Introduction	16	21	3.0	1.0	"The ""closed"" and ""open"" challenges have been kept from last year as well; participants could have chosen one or both."	0
2069	35879	35879	W09-1201	Introduction	17	22	3.0	1.0	In the closed challenge, systems had to be trained strictly with information contained in the given training corpus; in the open challenge, systems could have been developed making use of any kind of external tools and resources.	0
2070	35880	35880	W09-1201	Introduction	18	23	3.0	1.0	This paper is organized as follows.	0
2071	35881	35881	W09-1201	Introduction	19	24	4.0	1.0	Section 2 defines the task, including the format of the data, the evaluation metrics, and the two challenges.	0
2072	35882	35882	W09-1201	Introduction	20	25	4.0	1.0	A substantial portion of the paper (Section 3) is devoted to the description of the conversion and development of the data sets in the additional languages.	0
2073	35883	35883	W09-1201	Introduction	21	26	4.0	1.0	Section 4 shows the main results of the submitted systems in the Joint and SRL-only tasks.	0
2074	35884	35884	W09-1201	Introduction	22	27	4.0	1.0	Section 5 summarizes the approaches implemented by participants.	0
2075	35885	35885	W09-1201	Introduction	23	28	4.0	1.0	Section 6 concludes the paper.	0
2076	35886	35886	W09-1201	Introduction	24	29	4.0	1.0	In all sections, we will mention some of the differences between last year's and this year's tasks while keeping the text self-contained whenever possible; for details and observations on the English data, please refer to the overview paper of the CoNLL-2008 Shared Task (Surdeanu et al., 2008) and to the references mentioned in the sections describing the other languages.	0
2077	36304	36304	W10-3001	Task Definitions	1	105	4.0	2.0	Two uncertainty detection tasks (sentence classification and in-sentence hedge scope detection) in two domains (biological publications and Wikipedia articles) with three types of submissions (closed, cross and open) were given to the participants of the CoNLL-2010 Shared Task.	1
2078	36604	36604	W11-1901	Task Description	1	183	1.0	2.0	The CoNLL-2011 shared task was based on the English portion of the OntoNotes 4.0 data.	1
2079	36605	36605	W11-1901	Task Description	2	184	2.0	2.0	The task was to automatically identify mentions of entities and events in text and to link the coreferring mentions together to form entity/event chains.	1
2080	36606	36606	W11-1901	Task Description	3	185	3.0	2.0	The target coreference decisions could be made using automatically predicted information on the other structural layers including the parses, semantic roles, word senses, and named entities.	0
2081	36607	36607	W11-1901	Task Description	4	186	4.0	2.0	As is customary for CoNLL tasks, there were two tracks, closed and open.	0
2082	36608	36608	W11-1901	Task Description	5	187	4.0	2.0	For the closed track, systems were limited to using the distributed resources, in order to allow a fair comparison of algorithm performance, while the open track allowed for almost unrestricted use of external resources in addition to the provided data.	0
2083	37215	37215	W12-4501	CoNLL-2012 Coreference Task	1	284	1.0	2.0	The CoNLL-2012 shared task was held across all three languages -English, Chinese and Arabicof the OntoNotes v5.0 data.	1
2084	37216	37216	W12-4501	CoNLL-2012 Coreference Task	2	285	1.0	2.0	The task was to automatically identify mentions of entities and events in text and to link the coreferring mentions together to form entity/event chains.	1
2085	37217	37217	W12-4501	CoNLL-2012 Coreference Task	3	286	1.0	2.0	The coreference decisions had to be made using automatically predicted information on other structural and semantic layers including the parses, semantic roles, word senses, and named entities.	0
2086	37218	37218	W12-4501	CoNLL-2012 Coreference Task	4	287	1.0	2.0	Given various factors, such as the lack of resources and state-of-the-art tools, and time constraints, we could not provide some layers of information for the Chinese and Arabic portion of the data.	0
2087	37219	37219	W12-4501	CoNLL-2012 Coreference Task	5	288	2.0	2.0	The three languages are from quite different language families.	0
2088	37220	37220	W12-4501	CoNLL-2012 Coreference Task	6	289	2.0	2.0	The morphology of these languages is quite different.	0
2089	37221	37221	W12-4501	CoNLL-2012 Coreference Task	7	290	2.0	2.0	Arabic has a complex morphology, English has limited morphology, whereas Chinese has very little morphology.	0
2090	37222	37222	W12-4501	CoNLL-2012 Coreference Task	8	291	2.0	2.0	English word segmentation amounts to rule-based tokenization, and is close to perfect.	0
2091	37223	37223	W12-4501	CoNLL-2012 Coreference Task	9	292	3.0	2.0	In the case of Chinese and Arabic, although the tokenization/segmentation is not as good as English, the accuracies are in the high 90s.	0
2092	37224	37224	W12-4501	CoNLL-2012 Coreference Task	10	293	3.0	2.0	Syntactically, there are many dropped subjects and objects in Arabic and Chinese, whereas English is not a pro-drop language.	0
2093	37225	37225	W12-4501	CoNLL-2012 Coreference Task	11	294	3.0	2.0	Another difference is the amount of resources available for each language.	0
2094	37226	37226	W12-4501	CoNLL-2012 Coreference Task	12	295	3.0	2.0	English has probably the most resources at its disposal, whereas Chinese and Arabic lack significantly -Arabic more so than Chinese.	0
2095	37227	37227	W12-4501	CoNLL-2012 Coreference Task	13	296	4.0	2.0	Given this fact, plus the fact that the CoNLL format cannot handle multiple segmentations, and that it would complicate scoring since we are using exact token boundaries (as discussed later in Section 4.5), we decided to allow the use of gold, treebank segmentation for all languages.	0
2096	37228	37228	W12-4501	CoNLL-2012 Coreference Task	14	297	4.0	2.0	In the case of Chinese, the words themselves are lemmas, so no additional information needs to be provided.	0
2097	37229	37229	W12-4501	CoNLL-2012 Coreference Task	15	298	4.0	2.0	For Arabic, by default written text is unvocalised, so we decided to also provide correct, gold standard lemmas, along with the correct vocalized version of the tokens.	0
2098	37230	37230	W12-4501	CoNLL-2012 Coreference Task	16	299	4.0	2.0	Table 2 lists which layers were available and quality of the provided layers (when provided.)	0
2099	37231	37231	W12-4501	CoNLL-2012 Coreference Task	17	300	4.0	2.0	 	0
2100	37769	37769	W13-3601	Introduction	1	5	1.0	1.0	Grammatical error correction is the shared task of the Seventeenth Conference on Computational Natural Language Learning in 2013 (CoNLL-2013).	0
2101	37770	37770	W13-3601	Introduction	2	6	1.0	1.0	In this task, given an English essay written by a learner of English as a second language, the goal is to detect and correct the grammatical errors present in the essay, and return the corrected essay.	1
2102	37771	37771	W13-3601	Introduction	3	7	1.0	1.0	This task has attracted much recent research interest, with two shared tasks Helping Our Own (HOO) 2011 and 2012 organized in the past two years (Dale and Kilgarriff, 2011;	0
2103	37772	37772	W13-3601	Introduction	4	8	2.0	1.0	Dale et al., 2012).	0
2104	37773	37773	W13-3601	Introduction	5	9	2.0	1.0	In contrast to previous CoNLL shared tasks which focused on particular subtasks of natural language processing, such as named entity recognition, semantic role labeling, dependency parsing, or coreference resolution, grammatical error correction aims at building a complete end-to-end application.	0
2105	37774	37774	W13-3601	Introduction	6	10	2.0	1.0	This task is challenging since for many error types, current grammatical error correction systems do not achieve high performance and much research is still needed.	0
2106	37775	37775	W13-3601	Introduction	7	11	2.0	1.0	Also, tackling this task has far-reaching impact, since it is estimated that hundreds of millions of people worldwide are learning English and they benefit directly from an automated grammar checker.	0
2107	37776	37776	W13-3601	Introduction	8	12	3.0	1.0	The CoNLL-2013 shared task provides a forum for participating teams to work on the same grammatical error correction task, with evaluation on the same blind test set using the same evaluation metric and scorer.	0
2108	37777	37777	W13-3601	Introduction	9	13	3.0	1.0	This overview paper contains a detailed description of the shared task, and is organized as follows.	0
2109	37778	37778	W13-3601	Introduction	10	14	3.0	1.0	Section 2 provides the task definition.	0
2110	37779	37779	W13-3601	Introduction	11	15	3.0	1.0	Section 3 describes the annotated training data provided and the blind test data.	0
2111	37780	37780	W13-3601	Introduction	12	16	4.0	1.0	Section 4 describes the evaluation metric and the scorer.	0
2112	37781	37781	W13-3601	Introduction	13	17	4.0	1.0	Section 5 lists the participating teams and outlines the approaches to grammatical error correction used by the teams.	0
2113	37782	37782	W13-3601	Introduction	14	18	4.0	1.0	Section 6 presents the results of the shared task.	0
2114	37783	37783	W13-3601	Introduction	15	19	4.0	1.0	Section 7 concludes the paper.	0
2115	37960	37960	W14-1701	Introduction	1	8	1.0	1.0	Grammatical error correction is the shared task of the Eighteenth Conference on Computational Natural Language Learning in 2014(CoNLL-2014.	0
2116	37961	37961	W14-1701	Introduction	2	9	1.0	1.0	In this task, given an English essay written by a learner of English as a second language, the goal is to detect and correct the grammatical errors of all error types present in the essay, and return the corrected essay.	1
2117	37962	37962	W14-1701	Introduction	3	10	1.0	1.0	This task has attracted much recent research interest, with two shared tasks Helping Our Own (HOO) organized in 2011 and 2012 (Dale and Kilgarriff, 2011;	0
2118	37963	37963	W14-1701	Introduction	4	11	2.0	1.0	Dale et al., 2012), and a CoNLL shared task on grammatical error correction organized in 2013 .	0
2119	37964	37964	W14-1701	Introduction	5	12	2.0	1.0	In contrast to previous CoNLL shared tasks which focused on particular subtasks of natural language processing, such as named entity recognition, semantic role labeling, dependency parsing, or coreference resolution, grammatical error correction aims at building a complete end-to-end application.	0
2120	37965	37965	W14-1701	Introduction	6	13	2.0	1.0	This task is challenging since for many error types, current grammatical error correction systems do not achieve high performance and much research is still needed.	0
2121	37966	37966	W14-1701	Introduction	7	14	2.0	1.0	Also, tackling this task has farreaching impact, since it is estimated that hundreds of millions of people worldwide are learning English and they benefit directly from an automated grammar checker.	0
2122	37967	37967	W14-1701	Introduction	8	15	3.0	1.0	The CoNLL-2014 shared task provides a forum for participating teams to work on the same grammatical error correction task, with evaluation on the same blind test set using the same evaluation metric and scorer.	0
2123	37968	37968	W14-1701	Introduction	9	16	3.0	1.0	This overview paper contains a detailed description of the shared task, and is organized as follows.	0
2124	37969	37969	W14-1701	Introduction	10	17	3.0	1.0	Section 2 provides the task definition.	0
2125	37970	37970	W14-1701	Introduction	11	18	3.0	1.0	Section 3 describes the annotated training data provided and the blind test data.	0
2126	37971	37971	W14-1701	Introduction	12	19	4.0	1.0	Section 4 describes the evaluation metric and the scorer.	0
2127	37972	37972	W14-1701	Introduction	13	20	4.0	1.0	Section 5 lists the participating teams and outlines the approaches to grammatical error correction used by the teams.	0
2128	37973	37973	W14-1701	Introduction	14	21	4.0	1.0	Section 6 presents the results of the shared task, including a discussion on cross annotator comparison.	0
2129	37974	37974	W14-1701	Introduction	15	22	4.0	1.0	Section 7 concludes the paper.	0
2130	38460	38460	K16-2001	Task Definition	1	31	1.0	1.0	The goal of the shared task on shallow discourse parsing is to detect and categorize individual discourse relations.	0
2131	38461	38461	K16-2001	Task Definition	2	32	1.0	1.0	Specifically, given a newswire article as input, a participating system is asked to return the set of discourse relations it can identify in the text.	1
2132	38462	38462	K16-2001	Task Definition	3	33	1.0	1.0	A discourse relation is defined as a relation taking two abstract objects (events, states, facts, or propositions) as arguments (Prasad et al., 2008;	1
2133	38463	38463	K16-2001	Task Definition	4	34	2.0	1.0	Prasad et al., 2014).	0
2134	38464	38464	K16-2001	Task Definition	5	35	2.0	1.0	Discourse relations may be expressed with explicit connectives like because, however, but, or implicitly inferred between two argument spans interpretable as abstract objects.	0
2135	38465	38465	K16-2001	Task Definition	6	36	2.0	1.0	In the current version of the PDTB, only adjacent spans are considered.	0
2136	38466	38466	K16-2001	Task Definition	7	37	3.0	1.0	Each discourse relation is labeled with a sense selected from a sense hierarchy.	0
2137	38467	38467	K16-2001	Task Definition	8	38	3.0	1.0	Its argument spans may be sentences, clauses, or in some rare cases, noun phrases.	0
2138	38468	38468	K16-2001	Task Definition	9	39	3.0	1.0	To detect a discourse relation, a participating system needs to:	0
2139	38469	38469	K16-2001	Task Definition	10	40	4.0	1.0	1	0
2140	38470	38470	K16-2001	Task Definition	11	41	4.0	1.0	"Identify the text span of an explicit discourse connective, if present, or the po-sition between adjacent sentences as the proxy site of an implicit discourse relation; 2. Identify the two text spans that serve as arguments to the relation; 3. Label the arguments as Arg1 or Arg2, as appropriate; 4. Predict the sense of the discourse relation (e.g., ""Cause"", ""Condition"", ""Contrast"")."	0
