	Unnamed: 0	id	paper_id	headers	local_pos	global_pos	local_pct	global_pct	sentences	labels
1290	22483	22483	S18-11	Introduction	22	28	2.0	1.0	On the contrary, script knowledge is often implicit in the texts as it is assumed to be known to the comprehender.	0
1291	22484	22484	S18-11	Introduction	23	29	2.0	1.0	Because of this implicitness, learning script knowledge from texts is very challenging.	0
1292	22485	22485	S18-11	Introduction	24	30	2.0	1.0	There are few exceptions of corpora containing narrative texts that explicitly instantiate script knowledge.	0
1293	22486	22486	S18-11	Introduction	25	31	2.0	1.0	An example is the InScript , which contains short and simple narratives, that very explicitly mention script events and participants.	0
1294	22487	22487	S18-11	Introduction	26	32	2.0	1.0	The Dinners from Hell corpus (Rudinger et al., 2015a) is a similar dataset centered around the EATING IN A RESTAURANT scenario.	0
1295	22488	22488	S18-11	Introduction	27	33	2.0	1.0	In the past, script modeling systems have been evaluated using intrinsic tasks such as event ordering (Modi and Titov, 2014), paraphrasing (Regneri et al., 2010;	0
1296	22489	22489	S18-11	Introduction	28	34	2.0	1.0	Wanzare et al., 2017), event prediction (namely, the narrative cloze task)	0
1297	22490	22490	S18-11	Introduction	29	35	2.0	1.0	Jurafsky, 2008, 2009;	0
1298	22491	22491	S18-11	Introduction	30	36	2.0	1.0	Rudinger et al., 2015b;Modi, 2016) or story completion (e.g. the story cloze task T	0
1299	22492	22492	S18-11	Introduction	31	37	2.0	1.0	It was a long day at work and I decided to stop at the gym before going home.	0
1300	22493	22493	S18-11	Introduction	32	38	3.0	1.0	I ran on the treadmill and lifted some weights.	0
1301	22494	22494	S18-11	Introduction	33	39	3.0	1.0	I decided I would also swim a few laps in the pool.	0
1302	22495	22495	S18-11	Introduction	34	40	3.0	1.0	Once I was done working out, I went in the locker room and stripped down and wrapped myself in a towel.	0
1303	22496	22496	S18-11	Introduction	35	41	3.0	1.0	I went into the sauna and turned on the heat.	0
1304	22497	22497	S18-11	Introduction	36	42	3.0	1.0	I let it get nice and steamy.	0
1305	22498	22498	S18-11	Introduction	37	43	3.0	1.0	I sat down and relaxed.	0
1306	22499	22499	S18-11	Introduction	38	44	3.0	1.0	I let my mind think about nothing but peaceful, happy thoughts.	0
1307	22500	22500	S18-11	Introduction	39	45	3.0	1.0	I stayed in there for only about ten minutes because it was so hot and steamy.	0
1308	22501	22501	S18-11	Introduction	40	46	3.0	1.0	When I got out, I turned the sauna off to save energy and took a cool shower.	0
1309	22502	22502	S18-11	Introduction	41	47	3.0	1.0	I got out of the shower and dried off.	0
1310	22503	22503	S18-11	Introduction	42	48	3.0	1.0	After that, I put on my extra set of clean clothes I brought with me, and got in my car and drove home.	0
1311	22504	22504	S18-11	Introduction	43	49	3.0	1.0	Q1	0
1312	22505	22505	S18-11	Introduction	44	50	3.0	1.0	Where did they sit inside the sauna?	0
1313	22506	22506	S18-11	Introduction	45	51	3.0	1.0	a. on the floor b. on a bench Q2 How long did they stay in the sauna?	0
1314	22507	22507	S18-11	Introduction	46	52	3.0	1.0	a. about ten minutes b. over thirty minutes Figure 1: An example for a text from MCScript with 2 reading comprehension questions.	0
1315	22508	22508	S18-11	Introduction	47	53	3.0	1.0	(Mostafazadeh et al., 2016)).	0
1316	22509	22509	S18-11	Introduction	48	54	4.0	1.0	These tasks test a system's ability to learn script knowledge from a text but they do not provide a mechanism to evaluate how useful script knowledge is in natural language understanding tasks.	0
1317	22510	22510	S18-11	Introduction	49	55	4.0	1.0	Our shared task bridges this gap by directly relating commonsense knowledge and language comprehension.	0
1318	22511	22511	S18-11	Introduction	50	56	4.0	1.0	The task has a machine comprehension setting: A machine is given a text document and asked questions based on the text.	1
1319	22512	22512	S18-11	Introduction	51	57	4.0	1.0	In addition to what is mentioned in the text, answering the questions requires knowledge beyond the facts mentioned in the text.	1
1320	22513	22513	S18-11	Introduction	52	58	4.0	1.0	In particular, a substantial subset of questions requires inference over commonsense knowledge via scripts.	1
1321	22514	22514	S18-11	Introduction	53	59	4.0	1.0	For example, consider the short narrative in (1).	0
1322	22515	22515	S18-11	Introduction	54	60	4.0	1.0	For the first question, the correct choice for an answer requires commonsense knowledge about the activity of going to the sauna, which goes beyond what is mentioned in the text:	0
1323	22516	22516	S18-11	Introduction	55	61	4.0	1.0	Usually, people sit on benches inside a sauna, an information that is not given in the text.	0
1324	22517	22517	S18-11	Introduction	56	62	4.0	1.0	The dataset also comprises questions that can just be answered from the text, as the second question:	0
1325	22518	22518	S18-11	Introduction	57	63	4.0	1.0	The information about the duration of the stay is given literally in the text.	0
1326	22519	22519	S18-11	Introduction	58	64	4.0	1.0	The paper is organized as follows:	0
1327	22520	22520	S18-11	Introduction	59	65	4.0	1.0	In Section 2, we give an overview of other machine comprehension datasets.	0
1328	22521	22521	S18-11	Introduction	60	66	4.0	2.0	In Section 3, we describe the dataset used for our shared task.	0
1329	22522	22522	S18-11	Introduction	61	67	4.0	2.0	Section 4.2 gives details about the setup of our task.	0
1330	22523	22523	S18-11	Introduction	62	68	4.0	2.0	In Section 5, information about participating systems is given.	0
1331	22524	22524	S18-11	Introduction	63	69	4.0	2.0	Results are presented and discussed in Sections 6 and 8, respectively.	0
1332	22718	22718	S18-12	abstract	1	2	1.0	1.0	A natural language argument is composed of a claim as well as reasons given as premises for the claim.	0
1333	22719	22719	S18-12	abstract	2	3	1.0	1.0	The warrant explaining the reasoning is usually left implicit, as it is clear from the context and common sense.	0
1334	22720	22720	S18-12	abstract	3	4	2.0	1.0	This makes a comprehension of arguments easy for humans but hard for machines.	0
1335	22721	22721	S18-12	abstract	4	5	2.0	1.0	This paper summarizes the first shared task on argument reasoning comprehension.	0
1336	22722	22722	S18-12	abstract	5	6	3.0	1.0	Given a premise and a claim along with some topic information, the goal is to automatically identify the correct warrant among two candidates that are plausible and lexically close, but in fact imply opposite claims.	1
1337	22723	22723	S18-12	abstract	6	7	3.0	1.0	We describe the dataset with 1970 instances that we built for the task, and we outline the 21 computational approaches that participated, most of which used neural networks.	0
1338	22724	22724	S18-12	abstract	7	8	4.0	1.0	The results reveal the complexity of the task, with many approaches hardly improving over the random accuracy of  0.5.	0
1339	22725	22725	S18-12	abstract	8	9	4.0	1.0	Still, the best observed accuracy (0.712) underlines the principle feasibility of identifying warrants.	0
1340	22726	22726	S18-12	abstract	9	10	4.0	1.0	Our analysis indicates that an inclusion of external knowledge is key to reasoning comprehension.	0
1341	22988	22988	S19-1	title	1	1	4.0	1.0	SemEval-2019 Task 1: Cross-lingual Semantic Parsing with UCCA	1
1342	22989	22989	S19-1	abstract	1	2	1.0	1.0	We present the SemEval 2019 shared task on Universal Conceptual Cognitive Annotation (UCCA) parsing in English, German and French, and discuss the participating systems and results.	0
1343	22990	22990	S19-1	abstract	2	3	2.0	1.0	UCCA is a crosslinguistically applicable framework for semantic representation, which builds on extensive typological work and supports rapid annotation.	0
1344	22991	22991	S19-1	abstract	3	4	3.0	1.0	UCCA poses a challenge for existing parsing techniques, as it exhibits reentrancy (resulting in DAG structures), discontinuous structures and non-terminal nodes corresponding to complex semantic units.	0
1345	22992	22992	S19-1	abstract	4	5	4.0	1.0	The shared task has yielded improvements over the state-of-the-art baseline in all languages and settings.	0
1346	22993	22993	S19-1	abstract	5	6	4.0	1.0	Full results can be found in the task's website https://competitions. codalab.org/competitions/19160.	0
1347	23445	23445	S19-3	abstract	1	2	1.0	1.0	In this paper, we present the SemEval-2019 Task 3 -EmoContext: Contextual Emotion Detection in Text.	0
1348	23446	23446	S19-3	abstract	2	3	1.0	1.0	Lack of facial expressions and voice modulations make detecting emotions in text a challenging problem.	0
1349	23447	23447	S19-3	abstract	3	4	2.0	1.0	"For instance, as humans, on reading ""Why don't you ever text me!"" we can either interpret it as a sad or angry emotion and the same ambiguity exists for machines."	0
1350	23448	23448	S19-3	abstract	4	5	2.0	1.0	However, the context of dialogue can prove helpful in detection of the emotion.	0
1351	23449	23449	S19-3	abstract	5	6	2.0	1.0	In this task, given a textual dialogue i.e. an utterance along with two previous turns of context, the goal was to infer the underlying emotion of the utterance by choosing from four emotion classes -Happy, Sad, Angry and Others.	1
1352	23450	23450	S19-3	abstract	6	7	3.0	1.0	To facilitate the participation in this task, textual dialogues from user interaction with a conversational agent were taken and annotated for emotion classes after several data processing steps.	0
1353	23451	23451	S19-3	abstract	7	8	3.0	1.0	A training data set of 30160 dialogues, and two evaluation data sets, Test1 and Test2, containing 2755 and 5509 dialogues respectively were released to the participants.	0
1354	23452	23452	S19-3	abstract	8	9	4.0	1.0	A total of 311 teams made submissions to this task.	0
1355	23453	23453	S19-3	abstract	9	10	4.0	1.0	The final leader-board was evaluated on Test2 data set, and the highest ranked submission achieved 79.59 micro-averaged F1 score.	0
1356	23454	23454	S19-3	abstract	10	11	4.0	1.0	Our analysis of systems submitted to the task indicate that Bi-directional LSTM was the most common choice of neural architecture used, and most of the systems had the best performance for the Sad emotion class, and the worst for the Happy emotion class.	0
1357	23632	23632	S19-4	Task Definition	1	27	1.0	1.0	We define hyperpartisan news detection as follows:	0
1358	23633	23633	S19-4	Task Definition	2	28	2.0	1.0	Given the text and markup of an online news article, decide whether the article is hyperpartisan or not.	1
1359	23634	23634	S19-4	Task Definition	3	29	3.0	1.0	Hyperpartisan articles mimic the form of regular news articles, but are one-sided in the sense that opposing views are either ignored or fiercely attacked.	0
1360	23635	23635	S19-4	Task Definition	4	30	4.0	1.0	We deliberately disregard the distinction between left and right, since previous work has found that, in hyperpartisan form, both are more similar to each other in terms of style than either are to the mainstream (Potthast et al., 2018c).	0
1361	23636	23636	S19-4	Task Definition	5	31	4.0	1.0	The challenge of this task is to unveil the mimicking and to detect the hyperpartisan language, which may be distinguishable from regular news at the levels of style, syntax, semantics, and pragmatics.	0
1362	23862	23862	S19-5	Introduction	1	8	1.0	1.0	Hate Speech (HS) is commonly defined as any communication that disparages a person or a group on the basis of some characteristic such as race, color, ethnicity, gender, sexual orientation, nationality, religion, or other characteristics (Nockleby, 2000).	0
1363	23863	23863	S19-5	Introduction	2	9	1.0	1.0	Given the huge amount of user-generated contents on the Web, and in particular on social media, the problem of detecting, and therefore possibly contrasting the HS diffusion, is becoming fundamental, for instance for fighting against misogyny and xenophobia.	0
1364	23864	23864	S19-5	Introduction	3	10	1.0	1.0	Some key aspects feature online HS, such as virality, or presumed anonymity, which distinguish it from offline communication and make it potentially also more dangerous and hurtful.	0
1365	23865	23865	S19-5	Introduction	4	11	1.0	1.0	Often hate speech fosters discrimination against particular categories and undermines equality, an everlasting issue for each civil society.	0
1366	23866	23866	S19-5	Introduction	5	12	1.0	1.0	Among the mainly targeted categories there are immigrants and women.	0
1367	23867	23867	S19-5	Introduction	6	13	2.0	1.0	For the first target, especially raised by refugee crisis and political changes occurred in the last few years, several governments and policy makers are currently trying to address it, making especially interesting the development of tools for the identification and monitoring such kind of hate .	0
1368	23868	23868	S19-5	Introduction	7	14	2.0	1.0	For the second one instead, hate against the female gender is a long-time and well-known form of discrimination (Manne, 2017).	0
1369	23869	23869	S19-5	Introduction	8	15	2.0	1.0	Both these forms of hate content impact on the development of society and may be confronted by developing tools that automatically detect them.	0
1370	23870	23870	S19-5	Introduction	9	16	2.0	1.0	A large number of academic events and shared tasks for different languages (i.e. English, Spanish, Italian, German, Mexican-Spanish, Hindi) took place in the very recent past which are centered on HS and related topics, thus reflecting the interest by the NLP community.	0
1371	23871	23871	S19-5	Introduction	10	17	2.0	1.0	Let us mention the first and second edition of the Workshop on Abusive Language 1 (Waseem et al., 2017), the First Workshop on Trolling, Aggression and Cyberbullying (Kumar et al., 2018), that also included a shared task on aggression identification, the tracks on Automatic Misogyny Identification (AMI) (Fersini et al., 2018b) and on Authorship and Aggressiveness Analysis (MEX-A3T) (Carmona et al., 2018) proposed at the 2018 edition of IberEval 2 , the GermEval Shared Task on the Identification of Offensive Language (Wiegand et al., 2018), and finally the Automatic Misogyny Identification task (AMI) (Fersini et al., 2018a) and the Hate Speech Detection task (HaSpeeDe)  at EVALITA 2018 3 for investigating respectively misogyny and HS in Italian.	0
1372	23872	23872	S19-5	Introduction	11	18	2.0	1.0	Hat	0
1373	23873	23873	S19-5	Introduction	12	19	3.0	1.0	Eval consists in detecting hateful contents in social media texts, specifically in Twitter's posts, against two targets: immigrants and women.	1
1374	23874	23874	S19-5	Introduction	13	20	3.0	1.0	Moreover, the task implements a multilingual perspective where data for two widespread languages, English and Spanish, are provided for training and testing participant systems.	0
1375	23875	23875	S19-5	Introduction	14	21	3.0	1.0	The motivations for organizing HatEval go beyond the advancement of the state of the art for HS detection for each of the involved languages and targets.	0
1376	23876	23876	S19-5	Introduction	15	22	3.0	1.0	The variety of targets of hate and languages provides a unique comparative setting, both with respect to the amount of data collected and annotated applying the same scheme, and with respect to the results achieved by participants training their systems on those data.	0
1377	23877	23877	S19-5	Introduction	16	23	3.0	1.0	Such comparative setting may help in shedding new light on the linguistic and communication behaviour against these targets, paving the way for the integration of HS detection tools in several application contexts.	0
1378	23878	23878	S19-5	Introduction	17	24	3.0	1.0	Moreover, the participation of a very large amount of research groups in this task (see Section 4) has improved the possibility of in-depth investigation of the involved phenomena.	0
1379	23879	23879	S19-5	Introduction	18	25	4.0	1.0	The paper is organized as follows.	0
1380	23880	23880	S19-5	Introduction	19	26	4.0	1.0	In the next section, the datasets released to the participants for training and testing the systems are described.	0
1381	23881	23881	S19-5	Introduction	20	27	4.0	1.0	Section 3 presents the two subtasks and the measures we exploited in the evaluation.	0
1382	23882	23882	S19-5	Introduction	21	28	4.0	1.0	Section 4 reports on approaches and results of the participant systems.	0
1383	23883	23883	S19-5	Introduction	22	29	4.0	1.0	In Section 5, a preliminary analysis of common errors in top-ranked systems is proposed.	0
1384	23884	23884	S19-5	Introduction	23	30	4.0	1.0	Section 6 concludes the paper.	0
1385	24220	24220	S19-6	Conclusion	1	158	1.0	4.0	We have described SemEval-2019 Task 6 on Identifying and Categorizing Offensive Language in Social Media (OffensEval).	0
1386	24221	24221	S19-6	Conclusion	2	159	1.0	4.0	The task used OLID (Zampieri et al., 2019), a dataset of English tweets annotated for offensive language use, following a three-level hierarchical schema that considers (i) whether a message is offensive or not (for subtask A), (ii) what is the type of the offensive message (for sub-task B), and (iii) who is the target of the offensive message (for sub-task C).	1
1387	24222	24222	S19-6	Conclusion	3	160	1.0	4.0	Overall, about 800 teams signed up for Of-fensEval, and 115 of them actually participated in at least one sub-task.	0
1388	24223	24223	S19-6	Conclusion	4	161	1.0	4.0	The evaluation results have shown that the best systems used ensembles and state-of-the-art deep learning models such as BERT.	0
1389	24224	24224	S19-6	Conclusion	5	162	2.0	4.0	Overall, both deep learning and traditional machine learning classifiers were widely used.	0
1390	24225	24225	S19-6	Conclusion	6	163	2.0	4.0	More details about the indvididual systems can be found in their respective system description papers, which are published in the SemEval-2019 proceedings.	0
1391	24226	24226	S19-6	Conclusion	7	164	2.0	4.0	A list with references to these publications can be found in Table 2; note, however, that only 50 of the 115 participating teams submitted a system description paper.	0
1392	24227	24227	S19-6	Conclusion	8	165	2.0	4.0	As is traditional for SemEval, we have made OLID publicly available to the research community beyond the SemEval competition, hoping to facilitate future research on this important topic.	0
1393	24228	24228	S19-6	Conclusion	9	166	2.0	4.0	In fact, the OLID dataset and the SemEval-2019 Task 6 competition setup have already been used in teaching curricula in universities in UK and USA.	0
1394	24229	24229	S19-6	Conclusion	10	167	3.0	4.0	For example, student competitions based on Offens	0
1395	24230	24230	S19-6	Conclusion	11	168	3.0	4.0	Eval using OLID have been organized as part of Natural Language Processing and Text Analytics courses in two universities in UK: Imperial College London and the University of Leeds.	0
1396	24231	24231	S19-6	Conclusion	12	169	3.0	4.0	System papers describing some of the students' work are publicly accessible 11 and have also been made available on arXiv.org (Cambray and Podsadowski, 2019;	0
1397	24232	24232	S19-6	Conclusion	13	170	3.0	4.0	Frisiani et al., 2019;	0
1398	24233	24233	S19-6	Conclusion	14	171	4.0	4.0	Ong, 2019;Sapora et al., 2019;Puiu and Brabete, 2019;	0
1399	24234	24234	S19-6	Conclusion	15	172	4.0	4.0	Uglow et al., 2019).	0
1400	24235	24235	S19-6	Conclusion	16	173	4.0	4.0	Similarly, a number of students in Linguistics and Computer Science at the University of Arizona in USA have been using OLID in their coursework.	0
1401	24236	24236	S19-6	Conclusion	17	174	4.0	4.0	In future work, we plan to increase the size of the OLID dataset, while addressing issues such as class imbalance and the small size for the test partition, particularly for sub-tasks B and C.	0
1402	24237	24237	S19-6	Conclusion	18	175	4.0	4.0	We would also like to expand the dataset and the task to other languages.	0
1403	24239	24239	S19-7	abstract	1	2	1.0	1.0	"Since the first RumourEval shared task in 2017, interest in automated claim validation has greatly increased, as the danger of ""fake news"" has become a mainstream concern."	0
1404	24240	24240	S19-7	abstract	2	3	1.0	1.0	However automated support for rumour verification remains in its infancy.	0
1405	24241	24241	S19-7	abstract	3	4	2.0	1.0	It is therefore important that a shared task in this area continues to provide a focus for effort, which is likely to increase.	0
1406	24242	24242	S19-7	abstract	4	5	2.0	1.0	Rumour verification is characterised by the need to consider evolving conversations and news updates to reach a verdict on a rumour's veracity.	0
1407	24243	24243	S19-7	abstract	5	6	3.0	1.0	As in RumourEval 2017 we provided a dataset of dubious posts and ensuing conversations in social media, annotated both for stance and veracity.	0
1408	24244	24244	S19-7	abstract	6	7	3.0	1.0	The social media rumours stem from a variety of breaking news stories and the dataset is expanded to include Reddit as well as new Twitter posts.	0
1409	24245	24245	S19-7	abstract	7	8	4.0	1.0	There were two concrete tasks; rumour stance prediction and rumour verification, which we present in detail along with results achieved by participants.	1
1410	24246	24246	S19-7	abstract	8	9	4.0	1.0	We received 22 system submissions (a 70% increase from RumourEval 2017) many of which used state-of-the-art methodology to tackle the challenges involved.	0
1411	24458	24458	S19-8	Overview	1	10	1.0	1.0	The current coverage of the political landscape in both the press and in social media has led to an unprecedented situation.	0
1412	24459	24459	S19-8	Overview	2	11	1.0	1.0	Like never before, a statement in an interview, a press release, a blog note, or a tweet can spread almost instantaneously.	0
1413	24460	24460	S19-8	Overview	3	12	1.0	1.0	The speed of proliferation leaves little time for double-checking claims against the facts, which has proven critical in politics, e.g., during the 2016 presidential campaign in the USA, which was dominated by fake news in social media and by false claims.	0
1414	24461	24461	S19-8	Overview	4	13	1.0	1.0	Investigative journalists and volunteers have been working hard to get to the root of a claim and to present solid evidence in favor or against it.	0
1415	24462	24462	S19-8	Overview	5	14	1.0	1.0	Manual fact-checking is very time-consuming, and thus automatic methods have been proposed to speed-up the process, e.g., there has been work on checking the factuality/credibility of a claim, of a news article, or of an information source (Ba et al., 2016;	0
1416	24463	24463	S19-8	Overview	6	15	1.0	1.0	Zubiaga et al., 2016;	0
1417	24464	24464	S19-8	Overview	7	16	1.0	1.0	Ma et al., 2016;	0
1418	24465	24465	S19-8	Overview	8	17	2.0	1.0	Castillo et al., 2011;	0
1419	24466	24466	S19-8	Overview	9	18	2.0	1.0	Baly et al., 2018).	0
1420	24467	24467	S19-8	Overview	10	19	2.0	1.0	The process starts when a document is made public.	0
1421	24468	24468	S19-8	Overview	11	20	2.0	1.0	First, an intrinsic analysis is carried out in which check-worthy text fragments are identified.	0
1422	24469	24469	S19-8	Overview	12	21	2.0	1.0	Then, other documents that might support or rebut a claim in the document are retrieved from various sources.	0
1423	24470	24470	S19-8	Overview	13	22	2.0	1.0	Finally, by comparing a claim against the retrieved evidence, a system can determine whether the claim is likely true or likely false (or unsure, if no strong enough evidence either way could be found).	0
1424	24471	24471	S19-8	Overview	14	23	2.0	1.0	For instance, Ciampaglia et al. (2015) do this using a knowledge graph derived from Wikipedia.	0
1425	24472	24472	S19-8	Overview	15	24	2.0	1.0	The outcome could then be presented to a human expert for final judgement.	0
1426	24473	24473	S19-8	Overview	16	25	3.0	1.0	1 For our two subtasks, we explore factuality in the context of Community Question Answering (cQA) forums.	1
1427	24474	24474	S19-8	Overview	17	26	3.0	1.0	Forums such as StackOverflow, Yahoo!	0
1428	24475	24475	S19-8	Overview	18	27	3.0	1.0	Answers, and Quora are very popular these days, as they represent effective means for communities around particular topics to share information.	0
1429	24476	24476	S19-8	Overview	19	28	3.0	1.0	However, the information shared by the users is not always correct or accurate.	0
1430	24477	24477	S19-8	Overview	20	29	3.0	1.0	There are multiple factors explaining the presence of incorrect answers in cQA forums, e.g., misunderstanding of the question, ignorance or maliciousness of the responder.	0
1431	24478	24478	S19-8	Overview	21	30	3.0	1.0	Also, as a result of our dynamic world, the truth is time-sensitive: something that was true yesterday may be false today.	0
1432	24479	24479	S19-8	Overview	22	31	3.0	1.0	Moreover, forums are often barely moderated and thus lack systematic quality control.	0
1433	24480	24480	S19-8	Overview	23	32	3.0	1.0	Here we focus on checking the factuality of questions and answers in cQA forums.	0
1434	24481	24481	S19-8	Overview	24	33	4.0	1.0	This aspect was ignored in recent cQA tasks (Ishikawa et al., 2010;	0
1435	24482	24482	S19-8	Overview	25	34	4.0	1.0	Nakov et al., 2015	0
1436	24483	24483	S19-8	Overview	26	35	4.0	1.0	Nakov et al., , 2016a, where an answer is considered GOOD if it addresses the question, irrespective of its veracity, accuracy, etc.	0
1437	24484	24484	S19-8	Overview	27	36	4.0	1.0	Figure 1 presents an excerpt of an example from the Qatar Living Forum, with one question and three answers selected from a longer thread.	0
1438	24485	24485	S19-8	Overview	28	37	4.0	1.0	According to SemEval-2016 Task 3 (Nakov et al., 2016a), all three answers would be considered GOOD since they are formally answering the question.	0
1439	24486	24486	S19-8	Overview	29	38	4.0	1.0	Nevertheless, a 1 contains false information, while a 2 and a 3 are correct, as can be established from an official government website.	0
